"evidence_id","doc_id","source_file","page","chunk_index","chunk_text"
"graphflow_rag_p08_c001","graphflow_rag","graphflow_rag.pdf","8","1","(a). Generalization Results without Rerank (b). Generalization Results with Rerank Figure 3: Generalization Performance of KG-based RAG methods. GraphFlow shows superior cross-domain generalization performance, especially under the rerank setting (best viewed in color). respectively. SFT and PRM are two popular approaches that fine-tune the LLM agent to enhance RAG in recent works [76, 12, 25]. SFT, PRM, and GraphFlow are deployed with LLaMA3-8B-Instruct [17]. For agent-based methods, we use the agent to rerank all the retrieved results. Evaluation Metrics. All KG-based RAG methods retrieve every input query 20 times and generate 20 retrieval results for diversity and accuracy evaluation following the standard setting in STaRK [74]. We employ the following metrics to evaluate the retrieval performance. Hit@k denotes whether the ground truth is retrieved in the top-k results. We employ Hit@1 and Hit@5 to measure the retrieval precision of the different KG-based RAG methods. Mean Reciprocal Rank (MRR) measures the average of reciprocal ranks of the first ground-truth item in the retrieval results and encourages the ground-truth item to be retrieved in a higher rank. Recall@k (R@k) is a standard metric to measure the percentage of ground-truth items that appear in the top-k retrieved results. We employ Recall@20 (R@20) for evaluation. De-duplicate Recall@k (D-R@k) measures the percentage of unique ground-truth items that appear in the top-k retrieved results. This metric is used to evaluate the diversity of the correctly retrieved results. We use De-duplicate Recall@20 (D-R@20). 4.3 Main Results Accuracy. Table 1 presents the retrieval accuracy of various KG-based RAG"
"graphflow_rag_p08_c002","graphflow_rag","graphflow_rag.pdf","8","2","items that appear in the top-k retrieved results. This metric is used to evaluate the diversity of the correctly retrieved results. We use De-duplicate Recall@20 (D-R@20). 4.3 Main Results Accuracy. Table 1 presents the retrieval accuracy of various KG-based RAG methods on STaRK. Figure 4: GraphFlow shows improved re- trieval diversity on different difficulty levels of retrieval queries on STaRK-PRIME. GraphFlow consistently outperforms other KG-based RAG approaches on most metrics. In particular, it achieves higher Hit rates and MRR scores than the strong baseline ToG+GPT-4o with an average 10% im- provement in retrieval accuracy. Interestingly, ToG’s performance is highly sensitive to the choice of back- end model. When instantiated with LLaMA3-8B, ToG shows a significant drop in performance compared to using GPT-4o. Additionally, rerank has no effect in the ToG+LLaMA3-8B setup, as all retrieved results receive equally high scores, leaving the ranking unchanged. Two finetuned agent-based baselines, SFT and PRM, outperform ToG without finetuning, but still fall short of GraphFlow. While PRM training can leverage curated preference datasets with fine-grained process-level re- wards, such labeling is prohibitively expensive. Instead, GraphFlow achieves high-quality retrieval with only outcome rewards of retrieval trajectories. For retriever-based approaches, DenseRetriever, G-Retriever, and SubgraphRAG show moderate performance but are generally inferior to agent-based 8"
"graphflow_rag_p09_c001","graphflow_rag","graphflow_rag.pdf","9","1","methods. Overall, retriever-based methods remain more lightweight but trail behind agent-based approaches in retrieval accuracy. Diversity. Table 2 reports the retrieval diversity of different KG-based RAG methods on the STaRK benchmark. We evaluate both Recall@20 (R@20) and its de-duplicated variant (D-R@20), which better captures retrieval diversity. GraphFlow achieves the highest retrieval diversity across all datasets, outperforming both retriever-based and agent-based baselines. Its results not only match more ground-truth contents but also avoid redundancy. Notably, GraphFlow exceeds the strongest baseline (ToG+GPT-4o) by a large margin on the STaRK-PRIME dataset, highlighting its ability to retrieve results that are both relevant and diverse. Compared with PRM and SFT, GraphFlow also demonstrates superior diversity. In contrast, retriever-based methods retrieve less diverse content and cover fewer retrieval targets. 4.4 Quantifying Retrieval Quality We further employ the Seper score (∆Seper) [9] to quantify the retrieval quality of different KG-based retrieval methods. The Seper score is a recently proposed metric for evaluating retrieval utility by measuring semantic perplexity reduction after retrieval: ∆Seper = pM(a|q, d) − pM(a|q). Here, q is the question, d is the document associated with the retrieval item, andM is an LLM used for question answering. In our case, we use LLaMA3–8B–Instruct to instantiate M to keep consistent with the retrieval model. Since there is no ground-truth answer for the questions in the STaRK benchmark, we use the title or summarized description of the ground-truth retrieval item as a. We design the following metrics for comprehensive evaluation and report their mean and standard deviation"
"graphflow_rag_p09_c002","graphflow_rag","graphflow_rag.pdf","9","2","is no ground-truth answer for the questions in the STaRK benchmark, we use the title or summarized description of the ground-truth retrieval item as a. We design the following metrics for comprehensive evaluation and report their mean and standard deviation (std). • Step-∆Seper: the Seper score that quantity the retrieval quality of intermediate retrieval. • Answer-∆Seper: the Seper score that quantity the retrieval quality of the final result. As shown in Table 3, GraphFlow consistently achieves higherStep-∆Seper and Answer-∆Seper than all the baselines, demonstrating stronger information utility during retrieval. These results further confirm that GraphFlow can significantly improve the information utility when retrieving from text- rich KGs. Notice that all the methods have high variance in Step-∆Seper and Answer-∆Seper. The reason is the high variance in natural language entailment when calculating Seper scores. Moreover, we observe that some retrieval samples have negative Seper scores for all methods, indicating a negative impact on question answering when retrieving bad contents. 4.5 Further Discussion Cross-domain Generalization. Figure 3 reports the cross-domain generalization ability of different KG-based RAG methods. We use Hit@1 to evaluate the retrieval accuracy Compared with Sub- graphRAG using a small model for retrieval, SFT, PRM, and GraphFlow that finetune the LLM show better cross-domain generalization ability due to the over-parameterization [35, 15]. GraphFlow demonstrates superior cross-domain generalization, since it avoids from likelihood maximization objectives used by SFT and PRM. Instead, GraphFlow adaptively assigns the outcome reward of the retrieval trajectory to the flow values of intermediate states and guides the"
"graphflow_rag_p09_c003","graphflow_rag","graphflow_rag.pdf","9","3","[35, 15]. GraphFlow demonstrates superior cross-domain generalization, since it avoids from likelihood maximization objectives used by SFT and PRM. Instead, GraphFlow adaptively assigns the outcome reward of the retrieval trajectory to the flow values of intermediate states and guides the retrieval policy, leading to better generalization ability. More results are shown in Supplementary Material due to space limit. Performance on Hard Cases. We categorize the retrieval queries with different numbers of retrieval targets into 4 difficulty levels. Figure 4 shows the D-R@20 scores of KG-based RAG methods on retrieval queries on STaRK-PRIME at different levels. GraphFlow outperforms the other agent-based approaches by a large margin by covering more diverse and accurate retrieval targets, especially on the hard cases containing more than 15 retrieval targets. The performance on hard cases shows the superior performance of GraphFlow in retrieving more relevant and diverse results. More results of hard cases are shown in Supplementary Materials due to space limit. 5 Related Work KG-based RAG. Knowledge graphs (KGs) are widely used as knowledge sources in retrieval- augmented generation (RAG) [20? ] systems to enhance large language models (LLMs) with both relational and textual information for answering complex queries [14, 13, 8, 75]. A core challenge in 9"
"graphflow_rag_p10_c001","graphflow_rag","graphflow_rag.pdf","10","1","KG-based RAG lies in retrieving relevant knowledge from KGs in response to a given query. Recent methods addressing this problem can be broadly categorized into two approaches. Retrieval-based methods [80, 53, 21, 61, 93] leverage pretrained language models to encode the textual content in KGs into embeddings and use small models, such as MLP and GNN, to retrieve relevant information. In contrast, agent-based methods [68, 88, 50, 47, 45] employ LLMs as agents that iteratively traverse the KG to locate supporting evidence. While both paradigms have shown promise in knowledge graph question answering (KGQA) [37], their effectiveness in retrieving diverse and high-quality candidates for complex queries remains limited. Furthermore, complex queries often require retrieval from text-rich KGs, necessitating the joint consideration of both relational structure and text content. Although recent studies [ 50, 34] have begun to explore this setting and tackle complex queries, enhancing the diversity and accuracy of KG-based RAG is still underexplored. Process Reward Models. Process Reward Models (PRMs) [40, 32] have shown great promise in guiding LLMs with process supervision and have been adopted in many domains such as complex reasoning [7], alignment [58], and planning [6]. The key to PRMs is to construct a preference dataset with process supervision [60]. Previous works obtain the process supervision from human feedback and LLM evaluation. However, fine-grained process-level supervision is expensive for KG-based RAG due to the potentially vast search space of KGs and the difficulty of accessing the intermediate state during retrieval. Although early explorations are made"
"graphflow_rag_p10_c002","graphflow_rag","graphflow_rag.pdf","10","2","supervision from human feedback and LLM evaluation. However, fine-grained process-level supervision is expensive for KG-based RAG due to the potentially vast search space of KGs and the difficulty of accessing the intermediate state during retrieval. Although early explorations are made to use PRM to guide the retrieval process of RAG on unstructured knowledge bases [39, 65, 25, 76], they still need a preference dataset with process-level supervision. How to guide the retrieval process of KG-based RAG on structured KGs without process supervision data is still challenging. GFlowNet. GFlowNet [3] aims to sample diverse and high-quality candidates from an unnormalized density and has received increasing attention in sampling from discrete and vast spaces [16, 46, 11, 10, 49]. The goal of GFlowNet is to learn a policy that can lead to the terminal states with the likelihood in proportion to their rewards [86]. Some objects are proposed to optimize GFlowNet by regularizing the state flows and their transitions [69, 52, 51]. Recently, GFlowNet has also been introduced to improve the generative performance of LLMs and diffusion models by promoting diversity in the decoding process [71, 22, 81, 29, 43] . Differently, our work focuses on aligning the retrieval results of KG-based RAG with the knowledge required for real-world queries by estimating the state flow in multi-step retrieval. Moreover, we introduce a local exploration strategy to avoid visiting less-valued states, thus efficiently optimizing the detailed balance. 6 Conclusion We introduce GraphFlow, a novel framework that enhances existing KG-based RAG methods by enabling"
"graphflow_rag_p10_c003","graphflow_rag","graphflow_rag.pdf","10","3","the state flow in multi-step retrieval. Moreover, we introduce a local exploration strategy to avoid visiting less-valued states, thus efficiently optimizing the detailed balance. 6 Conclusion We introduce GraphFlow, a novel framework that enhances existing KG-based RAG methods by enabling accurate and diverse retrieval from text-rich KGs. By jointly optimizing a retrieval policy and a flow estimator via a detailed balance objective, GraphFlow effectively aligns the retrieval process with query-specific knowledge demands without explicit process-level reward. Extensive evaluation on the STaRK benchmark demonstrates that GraphFlow not only surpasses strong baselines deployed with GPT-4o, but also generalizes well to unseen KGs. These findings underscore the effectiveness and robustness of GraphFlow in supporting complex queries using textual and structured knowledge. Our future work will incorporate causality into KG-based RAG to improve the reasoning ability of LLMs [44, 5, 83], reduce forgetting [41, 42], and explore their scientific applications [78]. Acknowledgments and Disclosure of Funding This work is supported by the UKRI grant: Turing AI Fellowship EP/W002981/1. This work is jointly supported by the Shanghai Municipal Science and Technology Major Project and Shanghai Artificial Intelligence Laboratory. The authors would like to thank PCs, ACs, and all the reviewers for their insightful comments and suggestions. References [1] Micheal Abaho and Yousef H Alfaifi. Select and augment: enhanced dense retrieval knowledge graph augmentation (abstract reprint). In Proceedings of the AAAI Conference on Artificial Intelligence, volume 38, pages 22690–22690, 2024. 10"
"graphflow_rag_p11_c001","graphflow_rag","graphflow_rag.pdf","11","1","[2] Aaron Archer, MohammadHossein Bateni, MohammadTaghi Hajiaghayi, and Howard Karloff. Improved approximation algorithms for prize-collecting steiner tree and tsp. SIAM journal on computing, 40(2):309–332, 2011. [3] Yoshua Bengio, Salem Lahlou, Tristan Deleu, Edward J Hu, Mo Tiwari, and Emmanuel Bengio. Gflownet foundations. Journal of Machine Learning Research, 24(210):1–55, 2023. [4] Weijie Chen, Ting Bai, Jinbo Su, Jian Luan, Wei Liu, and Chuan Shi. Kg-retriever: Ef- ficient knowledge indexing for retrieval-augmented large language models. arXiv preprint arXiv:2412.05547, 2024. [5] Yongqiang Chen, Yonggang Zhang, Yatao Bian, Han Yang, MA Kaili, Binghui Xie, Tongliang Liu, Bo Han, and James Cheng. Learning causally invariant representations for out-of- distribution generalization on graphs. Advances in Neural Information Processing Systems , 35:22131–22148, 2022. [6] Sanjiban Choudhury. Process reward models for llm agents: Practical framework and directions. arXiv preprint arXiv:2502.10325, 2025. [7] Ganqu Cui, Lifan Yuan, Zefan Wang, Hanbin Wang, Wendi Li, Bingxiang He, Yuchen Fan, Tianyu Yu, Qixin Xu, Weize Chen, et al. Process reinforcement through implicit rewards. arXiv preprint arXiv:2502.01456, 2025. [8] Yuanning Cui, Zequn Sun, and Wei Hu. A prompt-based knowledge graph foundation model for universal in-context reasoning. Advances in Neural Information Processing Systems, 37:7095– 7124, 2024. [9] Lu Dai, Yijie Xu, Jinhui Ye, Hao Liu, and Hui Xiong. Seper: Measure retrieval utility through the lens of semantic perplexity reduction. In The Thirteenth International Conference on Learning Representations, 2025. [10] Tristan Deleu, António Góis, Chris Emezue, Mansi Rankawat, Simon Lacoste-Julien, Stefan Bauer, and Yoshua Bengio. Bayesian structure learning with generative flow networks. In Uncertainty in"
"graphflow_rag_p11_c002","graphflow_rag","graphflow_rag.pdf","11","2","lens of semantic perplexity reduction. In The Thirteenth International Conference on Learning Representations, 2025. [10] Tristan Deleu, António Góis, Chris Emezue, Mansi Rankawat, Simon Lacoste-Julien, Stefan Bauer, and Yoshua Bengio. Bayesian structure learning with generative flow networks. In Uncertainty in Artificial Intelligence, pages 518–528. PMLR, 2022. [11] Tristan Deleu, Mizu Nishikawa-Toomey, Jithendaraa Subramanian, Nikolay Malkin, Laurent Charlin, and Yoshua Bengio. Joint bayesian inference of graphical structure and parameters with a single generative flow network. Advances in Neural Information Processing Systems, 36:31204–31231, 2023. [12] Guanting Dong, Yutao Zhu, Chenghao Zhang, Zechen Wang, Ji-Rong Wen, and Zhicheng Dou. Understand what llm needs: Dual preference alignment for retrieval-augmented generation. In Proceedings of the ACM on Web Conference 2025, pages 4206–4225, 2025. [13] Yuxin Dong, Shuo Wang, Hongye Zheng, Jiajing Chen, Zhenhong Zhang, and Chihang Wang. Advanced rag models with graph structures: Optimizing complex knowledge reasoning and text generation. In 2024 5th International Symposium on Computer Engineering and Intelligent Communications (ISCEIC), pages 626–630. IEEE, 2024. [14] Darren Edge, Ha Trinh, Newman Cheng, Joshua Bradley, Alex Chao, Apurva Mody, Steven Truitt, Dasha Metropolitansky, Robert Osazuwa Ness, and Jonathan Larson. From local to global: A graph rag approach to query-focused summarization. arXiv preprint arXiv:2404.16130, 2024. [15] Leo Gao, John Schulman, and Jacob Hilton. Scaling laws for reward model overoptimization. In International Conference on Machine Learning, pages 10835–10866. PMLR, 2023. [16] Pouya M Ghari, Alex Tseng, Gökcen Eraslan, Romain Lopez, Tommaso Biancalani, Gabriele Scalia, and Ehsan Hajiramezanali. Generative flow networks assisted biological sequence editing. In NeurIPS 2023"
"graphflow_rag_p11_c003","graphflow_rag","graphflow_rag.pdf","11","3","reward model overoptimization. In International Conference on Machine Learning, pages 10835–10866. PMLR, 2023. [16] Pouya M Ghari, Alex Tseng, Gökcen Eraslan, Romain Lopez, Tommaso Biancalani, Gabriele Scalia, and Ehsan Hajiramezanali. Generative flow networks assisted biological sequence editing. In NeurIPS 2023 Generative AI and Biology (GenBio) Workshop, 2023. [17] Aaron Grattafiori, Abhimanyu Dubey, Abhinav Jauhri, Abhinav Pandey, Abhishek Kadian, Ahmad Al-Dahle, Aiesha Letman, Akhil Mathur, Alan Schelten, Alex Vaughan, et al. The llama 3 herd of models. arXiv preprint arXiv:2407.21783, 2024. 11"
"graphflow_rag_p12_c001","graphflow_rag","graphflow_rag.pdf","12","1","[18] Tiezheng Guo, Qingwen Yang, Chen Wang, Yanyi Liu, Pan Li, Jiawei Tang, Dapeng Li, and Yingyou Wen. Knowledgenavigator: Leveraging large language models for enhanced reasoning over knowledge graph. Complex & Intelligent Systems, 10(5):7063–7076, 2024. [19] Haoyu Han, Harry Shomer, Yu Wang, Yongjia Lei, Kai Guo, Zhigang Hua, Bo Long, Hui Liu, and Jiliang Tang. Rag vs. graphrag: A systematic evaluation and key insights. arXiv preprint arXiv:2502.11371, 2025. [20] Haoyu Han, Yu Wang, Harry Shomer, Kai Guo, Jiayuan Ding, Yongjia Lei, Mahantesh Halap- panavar, Ryan A Rossi, Subhabrata Mukherjee, Xianfeng Tang, et al. Retrieval-augmented generation with graphs (graphrag). arXiv preprint arXiv:2501.00309, 2024. [21] Xiaoxin He, Yijun Tian, Yifei Sun, Nitesh Chawla, Thomas Laurent, Yann LeCun, Xavier Bresson, and Bryan Hooi. G-retriever: Retrieval-augmented generation for textual graph understanding and question answering. Advances in Neural Information Processing Systems, 37:132876–132907, 2024. [22] Edward J Hu, Moksh Jain, Eric Elmoznino, Younesse Kaddar, Guillaume Lajoie, Yoshua Bengio, and Nikolay Malkin. Amortizing intractable inference in large language models. In The Twelfth International Conference on Learning Representations, 2024. [23] Edward J Hu, Yelong Shen, Phillip Wallis, Zeyuan Allen-Zhu, Yuanzhi Li, Shean Wang, Lu Wang, Weizhu Chen, et al. Lora: Low-rank adaptation of large language models. ICLR, 1(2):3, 2022. [24] Weihua Hu, Matthias Fey, Marinka Zitnik, Yuxiao Dong, Hongyu Ren, Bowen Liu, Michele Catasta, and Jure Leskovec. Open graph benchmark: Datasets for machine learning on graphs. Advances in neural information processing systems, 33:22118–22133, 2020. [25] Jerry Huang, Siddarth Madala, Risham Sidhu, Cheng Niu, Julia Hockenmaier, and Tong Zhang."
"graphflow_rag_p12_c002","graphflow_rag","graphflow_rag.pdf","12","2","Hongyu Ren, Bowen Liu, Michele Catasta, and Jure Leskovec. Open graph benchmark: Datasets for machine learning on graphs. Advances in neural information processing systems, 33:22118–22133, 2020. [25] Jerry Huang, Siddarth Madala, Risham Sidhu, Cheng Niu, Julia Hockenmaier, and Tong Zhang. Rag-rl: Advancing retrieval-augmented generation via rl and curriculum learning.arXiv preprint arXiv:2503.12759, 2025. [26] Lei Huang, Weijiang Yu, Weitao Ma, Weihong Zhong, Zhangyin Feng, Haotian Wang, Qiang- long Chen, Weihua Peng, Xiaocheng Feng, Bing Qin, et al. A survey on hallucination in large language models: Principles, taxonomy, challenges, and open questions. ACM Transactions on Information Systems, 43(2):1–55, 2025. [27] Bowen Jin, Hansi Zeng, Zhenrui Yue, Dong Wang, Hamed Zamani, and Jiawei Han. Search-r1: Training llms to reason and leverage search engines with reinforcement learning. arXiv preprint arXiv:2503.09516, 2025. [28] Jean Kaddour, Joshua Harris, Maximilian Mozes, Herbie Bradley, Roberta Raileanu, and Robert McHardy. Challenges and applications of large language models. arXiv preprint arXiv:2307.10169, 2023. [29] Haoqiang Kang, Enna Sachdeva, Piyush Gupta, Sangjae Bae, and Kwonjoon Lee. Gflowvlm: Enhancing multi-step reasoning in vision-language models with generative flow networks.arXiv preprint arXiv:2503.06514, 2025. [30] Vladimir Karpukhin, Barlas Oguz, Sewon Min, Patrick SH Lewis, Ledell Wu, Sergey Edunov, Danqi Chen, and Wen-tau Yih. Dense passage retrieval for open-domain question answering. In EMNLP (1), pages 6769–6781, 2020. [31] Thomas N Kipf and Max Welling. Semi-supervised classification with graph convolutional networks. In International Conference on Learning Representations, 2017. [32] Nathan Lambert, Valentina Pyatkin, Jacob Morrison, LJ Miranda, Bill Yuchen Lin, Khyathi Chandu, Nouha Dziri, Sachin Kumar, Tom Zick,"
"graphflow_rag_p12_c003","graphflow_rag","graphflow_rag.pdf","12","3","[31] Thomas N Kipf and Max Welling. Semi-supervised classification with graph convolutional networks. In International Conference on Learning Representations, 2017. [32] Nathan Lambert, Valentina Pyatkin, Jacob Morrison, LJ Miranda, Bill Yuchen Lin, Khyathi Chandu, Nouha Dziri, Sachin Kumar, Tom Zick, Yejin Choi, et al. Rewardbench: Evaluating reward models for language modeling. arXiv preprint arXiv:2403.13787, 2024. [33] Meng-Chieh Lee, Qi Zhu, Costas Mavromatis, Zhen Han, Soji Adeshina, Vassilis N Ioannidis, Huzefa Rangwala, and Christos Faloutsos. Hybgrag: Hybrid retrieval-augmented generation on textual and relational knowledge bases. arXiv preprint arXiv:2412.16311, 2024. 12"
"graphflow_rag_p13_c001","graphflow_rag","graphflow_rag.pdf","13","1","[34] Yongjia Lei, Haoyu Han, Ryan A Rossi, Franck Dernoncourt, Nedim Lipka, Mahantesh M Halappanavar, Jiliang Tang, and Yu Wang. Mixture of structural-and-textual retrieval over text-rich graph knowledge bases. arXiv preprint arXiv:2502.20317, 2025. [35] Jan Leike, David Krueger, Tom Everitt, Miljan Martic, Vishal Maini, and Shane Legg. Scalable agent alignment via reward modeling: a research direction. arXiv preprint arXiv:1811.07871, 2018. [36] Patrick Lewis, Ethan Perez, Aleksandra Piktus, Fabio Petroni, Vladimir Karpukhin, Naman Goyal, Heinrich Küttler, Mike Lewis, Wen-tau Yih, Tim Rocktäschel, et al. Retrieval-augmented generation for knowledge-intensive nlp tasks. Advances in neural information processing systems, 33:9459–9474, 2020. [37] Mufei Li, Siqi Miao, and Pan Li. Retrieval or reasoning: The roles of graphs and large language models in efficient knowledge-graph-based retrieval-augmented generation. In The Thirteenth International Conference on Learning Representations, 2025. [38] Vincent Li, Yule Fu, Tim Knappe, Kevin Han, and Kevin Zhu. Automating mathematical proof generation using large language model agents and knowledge graphs. arXiv preprint arXiv:2503.11657, 2025. [39] Xiaoxi Li, Guanting Dong, Jiajie Jin, Yuyao Zhang, Yujia Zhou, Yutao Zhu, Peitian Zhang, and Zhicheng Dou. Search-o1: Agentic search-enhanced large reasoning models. arXiv preprint arXiv:2501.05366, 2025. [40] Hunter Lightman, Vineet Kosaraju, Yuri Burda, Harrison Edwards, Bowen Baker, Teddy Lee, Jan Leike, John Schulman, Ilya Sutskever, and Karl Cobbe. Let’s verify step by step. InThe Twelfth International Conference on Learning Representations, 2023. [41] Runqi Lin, Chaojian Yu, Bo Han, and Tongliang Liu. On the over-memorization during natural, robust and catastrophic overfitting. In The Twelfth International Conference on Learning Representations, 2024. [42]"
