"evidence_id","doc_id","source_file","page","chunk_index","chunk_text"
"gfm_rag_p12_c002","gfm_rag","gfm_rag.pdf","12","2","G-retriever: Retrieval-augmented generation for textual graph understanding and question answering. Advances in Neural Information Processing Systems, 37:132876–132907, 2024. [19] Joel Hestness, Sharan Narang, Newsha Ardalani, Gregory Diamos, Heewoo Jun, Hassan Kianinejad, Md Mostofa Ali Patwary, Yang Yang, and Yanqi Zhou. Deep learning scaling is predictable, empirically. arXiv preprint arXiv:1712.00409, 2017. [20] Xanh Ho, Anh-Khoa Duong Nguyen, Saku Sugawara, and Akiko Aizawa. Constructing a multi-hop qa dataset for comprehensive evaluation of reasoning steps. In Proceedings of the 28th International Conference on Computational Linguistics, pages 6609–6625, 2020. [21] Xingyue Huang, Miguel Romero, Ismail Ceylan, and Pablo Barceló. A theory of link predic- tion via relational weisfeiler-leman on knowledge graphs. Advances in Neural Information Processing Systems, 36:19714–19748, 2023. [22] Gautier Izacard, Mathilde Caron, Lucas Hosseini, Sebastian Riedel, Piotr Bojanowski, Armand Joulin, and Edouard Grave. Unsupervised dense information retrieval with contrastive learning. Transactions on Machine Learning Research, 2022. [23] Soyeong Jeong, Jinheon Baek, Sukmin Cho, Sung Ju Hwang, and Jong C Park. Adaptive-rag: Learning to adapt retrieval-augmented large language models through question complexity. In Proceedings of the 2024 Conference of the North American Chapter of the Association for Computational Linguistics: Human Language Technologies (Volume 1: Long Papers), pages 7029–7043, 2024. [24] Zhengbao Jiang, Frank F Xu, Luyu Gao, Zhiqing Sun, Qian Liu, Jane Dwivedi-Yu, Yiming Yang, Jamie Callan, and Graham Neubig. Active retrieval augmented generation. In Proceedings of the 2023 Conference on Empirical Methods in Natural Language Processing, pages 7969–7992, 2023. [25] Qiao Jin, Bhuwan Dhingra, Zhengping Liu, William Cohen, and Xinghua Lu. PubMedQA:"
"gfm_rag_p12_c003","gfm_rag","gfm_rag.pdf","12","3","Yiming Yang, Jamie Callan, and Graham Neubig. Active retrieval augmented generation. In Proceedings of the 2023 Conference on Empirical Methods in Natural Language Processing, pages 7969–7992, 2023. [25] Qiao Jin, Bhuwan Dhingra, Zhengping Liu, William Cohen, and Xinghua Lu. PubMedQA: A dataset for biomedical research question answering. In Kentaro Inui, Jing Jiang, Vincent Ng, and Xiaojun Wan, editors, Proceedings of the 2019 Conference on Empirical Meth- ods in Natural Language Processing and the 9th International Joint Conference on Natu- ral Language Processing (EMNLP-IJCNLP), pages 2567–2577, Hong Kong, China, Novem- ber 2019. Association for Computational Linguistics. doi: 10.18653/v1/D19-1259. URL https://aclanthology.org/D19-1259/. 12"
"gfm_rag_p13_c001","gfm_rag","gfm_rag.pdf","13","1","[26] Ashutosh Joshi, Sheikh Muhammad Sarwar, Samarth Varshney, Sreyashi Nag, Shrivats Agrawal, and Juhi Naik. Reaper: Reasoning based retrieval planning for complex rag systems. InProceed- ings of the 33rd ACM International Conference on Information and Knowledge Management, pages 4621–4628, 2024. [27] Ehsan Kamalloo, Aref Jafari, Xinyu Zhang, Nandan Thakur, and Jimmy Lin. Hagrid: A human- llm collaborative dataset for generative information-seeking with attribution. arXiv preprint arXiv:2307.16883, 2023. [28] Xiaoxi Kang, Lizhen Qu, Lay-Ki Soon, Zhuang Li, and Adnan Trakic. Bridging law and data: Augmenting reasoning via a semi-structured dataset with irac methodology. arXiv preprint arXiv:2406.13217, 2024. [29] Jared Kaplan, Sam McCandlish, Tom Henighan, Tom B Brown, Benjamin Chess, Rewon Child, Scott Gray, Alec Radford, Jeffrey Wu, and Dario Amodei. Scaling laws for neural language models. arXiv preprint arXiv:2001.08361, 2020. [30] Vladimir Karpukhin, Barlas Oguz, Sewon Min, Patrick Lewis, Ledell Wu, Sergey Edunov, Danqi Chen, and Wen-tau Yih. Dense passage retrieval for open-domain question answering. In Proceedings of the 2020 Conference on Empirical Methods in Natural Language Processing (EMNLP), pages 6769–6781, 2020. [31] Chankyu Lee, Rajarshi Roy, Mengyao Xu, Jonathan Raiman, Mohammad Shoeybi, Bryan Catanzaro, and Wei Ping. Nv-embed: Improved techniques for training llms as generalist embedding models. arXiv preprint arXiv:2405.17428, 2024. [32] Mufei Li, Siqi Miao, and Pan Li. Simple is effective: The roles of graphs and large lan- guage models in knowledge-graph-based retrieval-augmented generation. In The Thirteenth International Conference on Learning Representations, 2025. [33] Shiyang Li, Yifan Gao, Haoming Jiang, Qingyu Yin, Zheng Li, Xifeng Yan, Chao Zhang, and"
"gfm_rag_p13_c002","gfm_rag","gfm_rag.pdf","13","2","is effective: The roles of graphs and large lan- guage models in knowledge-graph-based retrieval-augmented generation. In The Thirteenth International Conference on Learning Representations, 2025. [33] Shiyang Li, Yifan Gao, Haoming Jiang, Qingyu Yin, Zheng Li, Xifeng Yan, Chao Zhang, and Bing Yin. Graph reasoning for question answering with triplet retrieval. In Findings of the Association for Computational Linguistics: ACL 2023, pages 3366–3375, 2023. [34] Zehan Li, Xin Zhang, Yanzhao Zhang, Dingkun Long, Pengjun Xie, and Meishan Zhang. Towards general text embeddings with multi-stage contrastive learning. arXiv preprint arXiv:2308.03281, 2023. [35] Lei Liang, Mengshu Sun, Zhengke Gui, Zhongshu Zhu, Zhouyu Jiang, Ling Zhong, Yuan Qu, Peilong Zhao, Zhongpu Bo, Jin Yang, et al. Kag: Boosting llms in professional domains via knowledge augmented generation. arXiv preprint arXiv:2409.13731, 2024. [36] Zhutian Lin, Junwei Pan, Shangyu Zhang, Ximei Wang, Xi Xiao, Shudong Huang, Lei Xiao, and Jie Jiang. Understanding the ranking loss for recommendation with sparse user feedback. In Proceedings of the 30th ACM SIGKDD Conference on Knowledge Discovery and Data Mining, pages 5409–5418, 2024. [37] Jiawei Liu, Cheng Yang, Zhiyuan Lu, Junze Chen, Yibo Li, Mengmei Zhang, Ting Bai, Yuan Fang, Lichao Sun, Philip S Yu, et al. Graph foundation models: Concepts, opportunities and challenges. IEEE Transactions on Pattern Analysis and Machine Intelligence, 2025. [38] LINHAO LUO, Yuan-Fang Li, Reza Haf, and Shirui Pan. Reasoning on graphs: Faithful and interpretable large language model reasoning. In The Twelfth International Conference on Learning Representations, 2024. [39] Chaitanya Malaviya, Subin Lee, Sihao Chen, Elizabeth Sieber, Mark"
"gfm_rag_p13_c003","gfm_rag","gfm_rag.pdf","13","3","2025. [38] LINHAO LUO, Yuan-Fang Li, Reza Haf, and Shirui Pan. Reasoning on graphs: Faithful and interpretable large language model reasoning. In The Twelfth International Conference on Learning Representations, 2024. [39] Chaitanya Malaviya, Subin Lee, Sihao Chen, Elizabeth Sieber, Mark Yatskar, and Dan Roth. Expertqa: Expert-curated questions and attributed answers. arXiv preprint arXiv:2309.07852, 2023. [40] Haitao Mao, Zhikai Chen, Wenzhuo Tang, Jianan Zhao, Yao Ma, Tong Zhao, Neil Shah, Mikhail Galkin, and Jiliang Tang. Position: Graph foundation models are already here. In Forty-first International Conference on Machine Learning, 2024. 13"
"gfm_rag_p14_c001","gfm_rag","gfm_rag.pdf","14","1","[41] Costas Mavromatis and George Karypis. Gnn-rag: Graph neural retrieval for large language model reasoning. arXiv preprint arXiv:2405.20139, 2024. [42] Meta. Build the future of ai with meta llama 3, 2024. URL https://llama.meta.com/ llama3/. [43] Gabriel de Souza P Moreira, Radek Osmulski, Mengyao Xu, Ronay Ak, Benedikt Schifferer, and Even Oldridge. Nv-retriever: Improving text embedding models with effective hard-negative mining. arXiv preprint arXiv:2407.15831, 2024. [44] Abhilash Nandy, Soumya Sharma, Shubham Maddhashiya, Kapil Sachdeva, Pawan Goyal, and NIloy Ganguly. Question answering over electronic devices: A new benchmark dataset and a multi-task learning based QA framework. In Marie-Francine Moens, Xuanjing Huang, Lucia Specia, and Scott Wen-tau Yih, editors,Findings of the Association for Computational Linguistics: EMNLP 2021, pages 4600–4609, Punta Cana, Dominican Republic, November 2021. Association for Computational Linguistics. doi: 10.18653/v1/2021.findings-emnlp.392. URL https://aclanthology.org/2021.findings-emnlp.392/. [45] Tri Nguyen, Mir Rosenberg, Xia Song, Jianfeng Gao, Saurabh Tiwary, Rangan Majumder, and Li Deng. Ms marco: A human generated machine reading comprehension dataset. November 2016. [46] Jianmo Ni, Chen Qu, Jing Lu, Zhuyun Dai, Gustavo Hernandez Abrego, Ji Ma, Vincent Zhao, Yi Luan, Keith Hall, Ming-Wei Chang, et al. Large dual encoders are generalizable retrievers. In Proceedings of the 2022 Conference on Empirical Methods in Natural Language Processing, pages 9844–9855, 2022. [47] OpenAI. Hello gpt-4o, 2024. URL https://openai.com/index/hello-gpt-4o/. [48] OpenAI. Learning to reason with llms, 2024. URL https://openai.com/index/ learning-to-reason-with-llms/ . [49] Liu Pai, Wenyang Gao, Wenjie Dong, Lin Ai, Ziwei Gong, Songfang Huang, Li Zongsheng, Ehsan Hoque, Julia Hirschberg, and Yue Zhang. A survey on open information extraction"
"gfm_rag_p14_c002","gfm_rag","gfm_rag.pdf","14","2","[48] OpenAI. Learning to reason with llms, 2024. URL https://openai.com/index/ learning-to-reason-with-llms/ . [49] Liu Pai, Wenyang Gao, Wenjie Dong, Lin Ai, Ziwei Gong, Songfang Huang, Li Zongsheng, Ehsan Hoque, Julia Hirschberg, and Yue Zhang. A survey on open information extraction from rule-based model to large language model. Findings of the Association for Computational Linguistics: EMNLP 2024, pages 9586–9608, 2024. [50] Pranoy Panda, Ankush Agarwal, Chaitanya Devaguptapu, Manohar Kaul, and Prathosh Ap. Holmes: Hyper-relational knowledge graphs for multi-hop question answering using llms. In Proceedings of the 62nd Annual Meeting of the Association for Computational Linguistics (Volume 1: Long Papers), pages 13263–13282, 2024. [51] Boci Peng, Yun Zhu, Yongchao Liu, Xiaohe Bo, Haizhou Shi, Chuntao Hong, Yan Zhang, and Siliang Tang. Graph retrieval-augmented generation: A survey. arXiv preprint arXiv:2408.08921, 2024. [52] Haiquan Qiu, Yongqi Zhang, Yong Li, et al. Understanding expressivity of gnn in rule learning. In The Twelfth International Conference on Learning Representations, 2024. [53] Stephen E Robertson and Steve Walker. Some simple effective approximations to the 2-poisson model for probabilistic weighted retrieval. In SIGIR’94: Proceedings of the Seventeenth Annual International ACM-SIGIR Conference on Research and Development in Information Retrieval, organised by Dublin City University, pages 232–241. Springer, 1994. [54] Mobashir Sadat, Zhengyu Zhou, Lukas Lange, Jun Araki, Arsalan Gundroo, Bingqing Wang, Rakesh Menon, Md Parvez, and Zhe Feng. DelucionQA: Detecting hallucinations in domain- specific question answering. In Houda Bouamor, Juan Pino, and Kalika Bali, editors, Find- ings of the Association for Computational Linguistics: EMNLP 2023 , pages 822–835, Sin- gapore,"
"gfm_rag_p14_c003","gfm_rag","gfm_rag.pdf","14","3","Wang, Rakesh Menon, Md Parvez, and Zhe Feng. DelucionQA: Detecting hallucinations in domain- specific question answering. In Houda Bouamor, Juan Pino, and Kalika Bali, editors, Find- ings of the Association for Computational Linguistics: EMNLP 2023 , pages 822–835, Sin- gapore, December 2023. Association for Computational Linguistics. doi: 10.18653/v1/2023. findings-emnlp.59. URL https://aclanthology.org/2023.findings-emnlp.59/. 14"
"gfm_rag_p15_c001","gfm_rag","gfm_rag.pdf","15","1","[55] Keshav Santhanam, Omar Khattab, Jon Saad-Falcon, Christopher Potts, and Matei Zaharia. Colbertv2: Effective and efficient retrieval via lightweight late interaction. In Proceedings of the 2022 Conference of the North American Chapter of the Association for Computational Linguistics: Human Language Technologies, pages 3715–3734, 2022. [56] Parth Sarthi, Salman Abdullah, Aditi Tuli, Shubh Khanna, Anna Goldie, and Christopher D Manning. Raptor: Recursive abstractive processing for tree-organized retrieval. In The Twelfth International Conference on Learning Representations, 2024. [57] SBERT. Sentence-transformers all-mpnet-base-v2, 2021. URL https://huggingface.co/ sentence-transformers/all-mpnet-base-v2 . [58] Weihang Su, Yichen Tang, Qingyao Ai, Zhijing Wu, and Yiqun Liu. DRAGIN: Dynamic retrieval augmented generation based on the real-time information needs of large language models. In Lun-Wei Ku, Andre Martins, and Vivek Srikumar, editors, Proceedings of the 62nd Annual Meeting of the Association for Computational Linguistics (Volume 1: Long Papers), pages 12991–13013, Bangkok, Thailand, August 2024. Association for Computational Linguistics. doi: 10.18653/v1/2024.acl-long.702. URL https://aclanthology.org/2024. acl-long.702/. [59] Jiashuo Sun, Chengjin Xu, Lumingyuan Tang, Saizhuo Wang, Chen Lin, Yeyun Gong, Lionel Ni, Heung-Yeung Shum, and Jian Guo. Think-on-graph: Deep and responsible reasoning of large language model on knowledge graph. In The Twelfth International Conference on Learning Representations, 2024. [60] Jiabin Tang, Yuhao Yang, Wei Wei, Lei Shi, Lixin Su, Suqi Cheng, Dawei Yin, and Chao Huang. Graphgpt: Graph instruction tuning for large language models. In Proceedings of the 47th International ACM SIGIR Conference on Research and Development in Information Retrieval, pages 491–500, 2024. [61] Jiabin Tang, Yuhao Yang, Wei Wei, Lei Shi, Long Xia, Dawei Yin,"
"gfm_rag_p15_c002","gfm_rag","gfm_rag.pdf","15","2","Graphgpt: Graph instruction tuning for large language models. In Proceedings of the 47th International ACM SIGIR Conference on Research and Development in Information Retrieval, pages 491–500, 2024. [61] Jiabin Tang, Yuhao Yang, Wei Wei, Lei Shi, Long Xia, Dawei Yin, and Chao Huang. Higpt: Heterogeneous graph language model. In Proceedings of the 30th ACM SIGKDD Conference on Knowledge Discovery and Data Mining, pages 2842–2853, 2024. [62] Timothy J Teyler and Pascal DiScenna. The hippocampal memory indexing theory. Behavioral neuroscience, 100(2):147, 1986. [63] Harsh Trivedi, Niranjan Balasubramanian, Tushar Khot, and Ashish Sabharwal. Musique: Multihop questions via single-hop question composition. Transactions of the Association for Computational Linguistics, 10:539–554, 2022. [64] Harsh Trivedi, Niranjan Balasubramanian, Tushar Khot, and Ashish Sabharwal. Interleaving retrieval with chain-of-thought reasoning for knowledge-intensive multi-step questions. In Proceedings of the 61st Annual Meeting of the Association for Computational Linguistics (Volume 1: Long Papers), pages 10014–10037, 2023. [65] Denny Vrandeˇci´c and Markus Krötzsch. Wikidata: a free collaborative knowledgebase. Com- munications of the ACM, 57(10):78–85, 2014. [66] Zehong Wang, Zheyuan Zhang, Nitesh V Chawla, Chuxu Zhang, and Yanfang Ye. GFT: Graph foundation model with transferable tree vocabulary. In The Thirty-eighth Annual Conference on Neural Information Processing Systems, 2024. URL https://openreview.net/forum?id= 0MXzbAv8xy. [67] Zonghan Wu, Shirui Pan, Fengwen Chen, Guodong Long, Chengqi Zhang, and S Yu Philip. A comprehensive survey on graph neural networks. IEEE transactions on neural networks and learning systems, 32(1):4–24, 2020. [68] Lianghao Xia, Ben Kao, and Chao Huang. Opengraph: Towards open graph foundation models. arXiv preprint arXiv:2403.01121, 2024. [69]"
"gfm_rag_p15_c003","gfm_rag","gfm_rag.pdf","15","3","and S Yu Philip. A comprehensive survey on graph neural networks. IEEE transactions on neural networks and learning systems, 32(1):4–24, 2020. [68] Lianghao Xia, Ben Kao, and Chao Huang. Opengraph: Towards open graph foundation models. arXiv preprint arXiv:2403.01121, 2024. [69] Shitao Xiao, Zheng Liu, Peitian Zhang, and Niklas Muennighoff. C-pack: Packaged resources to advance general chinese embedding, 2023. 15"
"gfm_rag_p16_c001","gfm_rag","gfm_rag.pdf","16","1","[70] An Yang, Baosong Yang, Binyuan Hui, Bo Zheng, Bowen Yu, Chang Zhou, Chengpeng Li, Chengyuan Li, Dayiheng Liu, Fei Huang, Guanting Dong, Haoran Wei, Huan Lin, Jialong Tang, Jialin Wang, Jian Yang, Jianhong Tu, Jianwei Zhang, Jianxin Ma, Jin Xu, Jingren Zhou, Jinze Bai, Jinzheng He, Junyang Lin, Kai Dang, Keming Lu, Keqin Chen, Kexin Yang, Mei Li, Mingfeng Xue, Na Ni, Pei Zhang, Peng Wang, Ru Peng, Rui Men, Ruize Gao, Runji Lin, Shijie Wang, Shuai Bai, Sinan Tan, Tianhang Zhu, Tianhao Li, Tianyu Liu, Wenbin Ge, Xiaodong Deng, Xiaohuan Zhou, Xingzhang Ren, Xinyu Zhang, Xipin Wei, Xuancheng Ren, Yang Fan, Yang Yao, Yichang Zhang, Yu Wan, Yunfei Chu, Yuqiong Liu, Zeyu Cui, Zhenru Zhang, and Zhihao Fan. Qwen2 technical report. arXiv preprint arXiv:2407.10671, 2024. [71] Bishan Yang, Scott Wen-tau Yih, Xiaodong He, Jianfeng Gao, and Li Deng. Embedding entities and relations for learning and inference in knowledge bases. In Proceedings of the International Conference on Learning Representations (ICLR) 2015, 2015. [72] Zhilin Yang, Peng Qi, Saizheng Zhang, Yoshua Bengio, William Cohen, Ruslan Salakhutdinov, and Christopher D Manning. Hotpotqa: A dataset for diverse, explainable multi-hop question answering. In Proceedings of the 2018 Conference on Empirical Methods in Natural Language Processing, pages 2369–2380, 2018. [73] Michihiro Yasunaga, Hongyu Ren, Antoine Bosselut, Percy Liang, and Jure Leskovec. Qa-gnn: Reasoning with language models and knowledge graphs for question answering. In Proceedings of the 2021 Conference of the North American Chapter of the Association for Computational Linguistics: Human Language Technologies, pages 535–546,"
"gfm_rag_p16_c002","gfm_rag","gfm_rag.pdf","16","2","Antoine Bosselut, Percy Liang, and Jure Leskovec. Qa-gnn: Reasoning with language models and knowledge graphs for question answering. In Proceedings of the 2021 Conference of the North American Chapter of the Association for Computational Linguistics: Human Language Technologies, pages 535–546, 2021. [74] Alexandros Zeakis, George Papadakis, Dimitrios Skoutas, and Manolis Koubarakis. Pre- trained embeddings for entity resolution: an experimental analysis. Proceedings of the VLDB Endowment, 16(9):2225–2238, 2023. [75] Xinyu Zhang, Nandan Thakur, Odunayo Ogundepo, Ehsan Kamalloo, David Alfonso-Hermelo, Xiaoguang Li, Qun Liu, Mehdi Rezagholizadeh, and Jimmy Lin. Making a miracl: Multilingual information retrieval across a continuum of languages. arXiv preprint arXiv:2210.09984, 2022. [76] Lingfeng Zhong, Jia Wu, Qian Li, Hao Peng, and Xindong Wu. A comprehensive survey on automatic knowledge graph construction. ACM Computing Surveys, 56(4):1–62, 2023. [77] Shaowen Zhou, Bowen Yu, Aixin Sun, Cheng Long, Jingyang Li, and Jian Sun. A survey on neural open information extraction: Current status and future directions. In Lud De Raedt, editor, Proceedings of the Thirty-First International Joint Conference on Artificial Intelligence, IJCAI- 22, pages 5694–5701. International Joint Conferences on Artificial Intelligence Organization, 7 2022. doi: 10.24963/ijcai.2022/793. URL https://doi.org/10.24963/ijcai.2022/793. Survey Track. [78] Zhaocheng Zhu, Zuobai Zhang, Louis-Pascal Xhonneux, and Jian Tang. Neural bellman-ford networks: A general graph neural network framework for link prediction. Advances in Neural Information Processing Systems, 34:29476–29490, 2021. Appendix Table of Contents A Query-dependent GNNs for Multi-hop Reasoning and Retrieval 17 B Datasets 17 B.1 Multi-hop QA Datasets . . . . . . . . . . . . ."
"gfm_rag_p16_c003","gfm_rag","gfm_rag.pdf","16","3","in Neural Information Processing Systems, 34:29476–29490, 2021. Appendix Table of Contents A Query-dependent GNNs for Multi-hop Reasoning and Retrieval 17 B Datasets 17 B.1 Multi-hop QA Datasets . . . . . . . . . . . . . . . . . . . . . . . . . . . . . . 17 16"
"gfm_rag_p17_c001","gfm_rag","gfm_rag.pdf","17","1","B.2 Domain-specific RAG Datasets . . . . . . . . . . . . . . . . . . . . . . . . . . 18 C Baselines 19 D Implementations and Training Details 20 D.1 Training Data Construction . . . . . . . . . . . . . . . . . . . . . . . . . . . . 20 D.2 Model Settings . . . . . . . . . . . . . . . . . . . . . . . . . . . . . . . . . . . 20 D.3 Training Settings . . . . . . . . . . . . . . . . . . . . . . . . . . . . . . . . . . 20 E Additional Experiments 21 E.1 Effectiveness of Different Sentence Embeddings . . . . . . . . . . . . . . . . . 21 E.2 Effectiveness of Different Training Strategies . . . . . . . . . . . . . . . . . . . 22 E.3 Effectiveness of Loss Weights . . . . . . . . . . . . . . . . . . . . . . . . . . . 22 E.4 Effectiveness of Ranking Methods . . . . . . . ."
"gfm_rag_p17_c002","gfm_rag","gfm_rag.pdf","17","2",". . . . . . . . . . . . . . . . . . . . . . . . . . 22 E.4 Effectiveness of Ranking Methods . . . . . . . . . . . . . . . . . . . . . . . . 23 E.5 Ablation Study of Training Datasets . . . . . . . . . . . . . . . . . . . . . . . . 23 E.6 Model Transferability . . . . . . . . . . . . . . . . . . . . . . . . . . . . . . . 23 E.7 Details of Model Neural Scaling . . . . . . . . . . . . . . . . . . . . . . . . . . 24 E.8 Visualization of the Distribution of Multi-hop Prediction . . . . . . . . . . . . . 25 E.9 Cost and Impact of LLMs on KG-index Construction . . . . . . . . . . . . . . . 26 F Prompts 27 G Limitations 27 A Query-dependent GNNs for Multi-hop Reasoning and Retrieval We provide a detailed explanation about why query-dependent GNNs can be used for multi-hop reasoning and retrieval. Recent studies [21, 52] have theoretically proven that query-dependent GNNs are effective for capturing the multi-hop"
"gfm_rag_p17_c003","gfm_rag","gfm_rag.pdf","17","3","Query-dependent GNNs for Multi-hop Reasoning and Retrieval We provide a detailed explanation about why query-dependent GNNs can be used for multi-hop reasoning and retrieval. Recent studies [21, 52] have theoretically proven that query-dependent GNNs are effective for capturing the multi-hop logical associations on KGs to answer queries, such as: ∃y : politician_of(Barack Obama, y) ← work_in(Barack Obama, z1)∧city_of(z1, y), (20) where the right part denotes the logical associations can be executed to answer the query on the left, i.e., “politician_of(Barack Obama,y)”. This query is semantic equivalent to the nature language question: “ Barack Obama is the politician of which country? ”. By treating the input question as a “soft query” (query in nature language), we apply the query-dependent GNN (GFM) to bridge the gap between nature language and logical query. The GFM tries to understand the semantic of the questions and learn to conduct complex logical reasoning (e.g., multi-hop reasoning) on KGs for retrieval [73]. The learned logical associations for reasoning are shown in Section 4.8. Table 5: Statistics of the query-doc pairs and KGs used for training. Dataset #Q-doc Pair #Document #KG #Entity #Relation #Triple HotpotQA 20,000 204,822 20 1,930,362 967,218 6,393,342 MuSiQue 20,000 410,380 20 1,544,966 900,338 4,848,715 2Wiki 20,000 122,108 20 916,907 372,554 2,883,006 Total 60,000 737,310 60 4,392,235 2,240,110 14,125,063 B Datasets B.1 Multi-hop QA Datasets Three multi-hop QA datasets are used in our experiments: HotpotQA [ 72], MuSiQue [ 63], and 2WikiMultiHopQA (2Wiki) [20]. We provide a brief overview of these datasets below. 17"
"gfm_rag_p18_c001","gfm_rag","gfm_rag.pdf","18","1","Table 6: Statistics of the datasets and constructed KG-indexes used for testing. Dataset Domain #Test #Document #Entity #Relation #Triple HotpotQA Multi-hop 1,000 9,221 87,768 45,112 279,112 MuSiQue Multi-hop 1,000 11,656 100,853 55,944 319,618 2Wiki Multi-hop 1,000 6,119 48,779 20,748 160,950 PubMedQA Biomedical 2,450 5,932 42,389 20,952 149,782 DelucionQA Customer Support 184 235 2,669 2,298 6,183 TechQA Customer Support 314 769 10,221 4,606 57,613 ExpertQA Customer Support 203 808 11,079 6,810 16,541 EManual Customer Support 132 102 695 586 1,329 MS Marco General Knowledge 423 3,481 24,740 17,042 63,995 HAGRID General Knowledge 1,318 1,975 23,484 18,653 48,969 • HotpotQA [72] is a multi-hop QA dataset that requires reasoning over multiple documents to answer questions. The dataset consists of 97k question-answer pairs, where each question is associated with up to 2 supporting and several distracting documents. The questions are designed to be answerable using multiple pieces of information from the supporting documents. • MuSiQue [63] is a challenging multi-hop QA dataset with 25k 2-4 hop questions. It requires coherent multi-step reasoning to answer questions that span multiple documents. • 2WikiMultiHopQA (2Wiki) [20] is a multi-hop QA dataset that requires reasoning over multiple Wikipedia articles to answer questions. The dataset consists of 192k questions, which are designed to be answerable using information from 2 or 4 articles. In experiments, we adhere to the official data split to obtain the training samples and follow existing methods [64, 16] to use the same 1,000 samples from each validation set to avoid data leakage. We merge"
