"evidence_id","doc_id","source_file","page","chunk_index","chunk_text"
"bm25_prf_p01_c001","bm25_prf","bm25_prf.pdf","1","1","Foundations and TrendsR⃝ in Information Retrieval Vol. 3, No. 4 (2009) 333–389 c⃝ 2009 S. Robertson and H. Zaragoza DOI: 10.1561/1500000019 The Probabilistic Relevance Framework: BM25 and Beyond By Stephen Robertson and Hugo Zaragoza Contents 1 Introduction 334 2 Development of the Basic Model 336 2.1 Information Needs and Queries 336 2.2 Binary Relevance 337 2.3 The Probability Ranking Principle 337 2.4 Some Notation 338 2.5 A Note on Probabilities and Rank Equivalence 345 3 Derived Models 347 3.1 The Binary Independence Model 347 3.2 Relevance Feedback and Query Expansion 349 3.3 Blind Feedback 351 3.4 The Eliteness Model and BM25 352 3.5 Uses of BM25 360 3.6 Multiple Streams and BM25F 361 3.7 Non-Textual Relevance Features 365 3.8 Positional Information 367 3.9 Open Source Implementations of BM25 and BM25F 369"
"bm25_prf_p02_c001","bm25_prf","bm25_prf.pdf","2","1","4 Comparison with Other Models 371 4.1 Maron and Kuhns 371 4.2 The Uniﬁed Model 372 4.3 The Simple Language Model 374 4.4 The Relevance (Language) Model 375 4.5 Topic Models 375 4.6 Divergence from Randomness 376 5 Parameter Optimisation 377 5.1 Greedy Optimisation 378 5.2 Multidimensional Optimisation 380 5.3 Gradient Optimisation 382 6 Conclusions 384 References 385"
"bm25_prf_p03_c001","bm25_prf","bm25_prf.pdf","3","1","Foundations and TrendsR⃝ in Information Retrieval Vol. 3, No. 4 (2009) 333–389 c⃝ 2009 S. Robertson and H. Zaragoza DOI: 10.1561/1500000019 The Probabilistic Relevance Framework: BM25 and Beyond Stephen Robertson 1 and Hugo Zaragoza 2 1 Microsoft Research,7JJ Thomson Avenue, Cambridge CB3 0FB, UK ser@microsoft.com 2 Yahoo! Research, Av. Diagonal 177, Barcelona 08028, Spain hugoz@yahoo-inc.com Abstract The Probabilistic Relevance Framework (PRF) is a formal framework for document retrieval, grounded in work done in the 1970–1980s, which led to the development of one of the most successful text-retrieval algo- rithms, BM25. In recent years, research in the PRF has yielded new retrieval models capable of taking into account document meta-data (especially structure and link-graph information). Again, this has led to one of the most successful Web-search and corporate-search algo- rithms, BM25F. This work presents the PRF from a conceptual point of view, describing the probabilistic modelling assumptions behind the framework and the diﬀerent ranking algorithms that result from its application: the binary independence model, relevance feedback mod- els, BM25 and BM25F. It also discusses the relation between the PRF and other statistical models for IR, and covers some related topics, such as the use of non-textual features, and parameter optimisation for models with free parameters."
"bm25_prf_p04_c001","bm25_prf","bm25_prf.pdf","4","1","1 Introduction This monograph addresses theclassical probabilistic model of informa- tion retrieval. The model is characterised by including a speciﬁc notion of relevance, an explicit variable associated with a query–document pair, normally hidden in the sense ofnot observable. The model revolves around the notion of estimating a probability of relevance for each pair, and ranking documents in relation to a given query in descending order of probability of relevance. The best-known instantiation of the model is the BM25 term-weighting and document-scoring function. The model has been developed in stages over a period of about 30 years, with a precursor in 1960. A few of the main references are as follows: [30, 44, 46, 50, 52, 53, 58]; other surveys of a range of proba- bilistic approaches include [14, 17]. Some more detailed references are given below. There are a number of later developments of IR models which are also probabilistic but which diﬀer considerably from the models developed here — speciﬁcally and notably the language model (LM) approach [24, 26, 33] and thedivergence from randomness(DFR) mod- els [2]. For this reason we refer to the family of models developed here as the Probabilistic Relevance Framework(PRF), emphasising the 334"
"bm25_prf_p05_c001","bm25_prf","bm25_prf.pdf","5","1","335 importance of the relevance variable in the development of the models. We do not cover the development of other probabilistic models in the present survey, but some points of comparison are made. This is not primarily an experimental survey; throughout, asser- tions will be made about techniques which are said to work well. In general such statements derive from experimental results, many exper- iments by many people over a long period, which will not in general be fully referenced. The emphasis is on the theoretical development of the methods, the logic and assumptions behind the models. The survey is organised as follows. In Section 2 we develop the most generic retrieval model, which subsumes a number of speciﬁc instanti- ations developed in Section 3. In Section 4 we discuss the similarities and diﬀerences with other retrieval frameworks. Finally in Section 5 we give an overview of optimisation techniques we have used to tune the diﬀerent parameters in the models and Section 6 concludes the survey."
"bm25_prf_p06_c001","bm25_prf","bm25_prf.pdf","6","1","2 Development of the Basic Model 2.1 Information Needs and Queries We start from a notion of information need. We take a query to be a representation (not necessarily very good or very complete) of an individual user’s information need or perhaps search intent. We take relevance to mean the relevance of a document to the information need, as judged by the user. We make no speciﬁc assumption about the conceptual nature of relevance; in particular, we donot assume rel- evance to be topical in nature. 1 We do, however, makes some assump- tions about the formal status of the relevance variable, given below, which might be taken to imply some assumptions about its conceptual nature. 1 The notion of topic, as used in TREC, is somewhat akin to information need, or at least to a more detailed and complete representation and speciﬁcation of an information need. The use of the term ‘topic’ for this purpose is a little unfortunate, as it seems to imply some kind of topical nature of relevance. However, we also note that the widespread use of the term following TREC also includes some examples of non-topical ‘topics’, for example the home-page topics used in the TREC Web track [59]. 336"
"bm25_prf_p07_c001","bm25_prf","bm25_prf.pdf","7","1","2.2 Binary Relevance 337 2.2 Binary Relevance The assumptions about relevance are as follows: 1. Relevance is assumed to be a property of the document given information need only, assessable without reference to other documents; and 2. The relevance property is assumed to be binary. Either of these assumptions is at the least arguable. We might easily imagine situations in which one document’s relevance can only be per- ceived by the user in the context of another document, for example. Regarding the binary property, many recent experimental studies have preferred a graded notion of relevance. One might go further and sug- gest that diﬀerent documents may be relevant to a need in diﬀerent ways, not just to diﬀerent degrees. However, we emphasise that we consider the situation of a single information need (rather than the multiple needs or intents that might be represented by a single text query). If we take relevant to mean ‘the user would like to be pointed to this document’, the binary notion is at least moderately plausible. 2.3 The Probability Ranking Principle Given that an information retrieval system cannot know the values of the relevance property of each document, we assume that the infor- mation available to the system is at best probabilistic. That is, the known (to the system) properties of the document and the query may provide probabilistic or statistical evidence as to the relevance of that document to the underlying need. Potentially these properties may be rich and include a variety of"
"bm25_prf_p07_c002","bm25_prf","bm25_prf.pdf","7","2","the known (to the system) properties of the document and the query may provide probabilistic or statistical evidence as to the relevance of that document to the underlying need. Potentially these properties may be rich and include a variety of diﬀerent kinds of evidence; the only infor- mation assumed to be absent is the actual relevance property itself. Given whatever information is available, the system may make some statistical statement about the possible value of the relevance property. Given a binary document-by-document relevance property, then this statistical information may be completely encapsulated in aprobability of relevance. The probability of relevance of a given document to a"
"bm25_prf_p08_c001","bm25_prf","bm25_prf.pdf","8","1","338 Development of the Basic Model given query plays a central role in the present theory. We can in fact make a general statement about this: If retrieved documents are ordered by decreasing prob- ability of relevance on the data available, then the sys- tem’s eﬀectiveness is the best that can be obtained for the data. This is a statement of the Probability Ranking Principle (PRP), taken from [52], an abbreviated version of the one in [40]. The PRP can be justiﬁed under some further assumptions, for a range of speciﬁc measures of eﬀectiveness. It is not, however, completely general; one can also construct counter-examples. But these counter-examples depend on probabilities deﬁned over a population of users. The PRP is safe for the case considered: an individual user. It will be assumed for the remainder of this work. 2.4 Some Notation In this section, we introduce some of the notation that will be used throughout the survey. The notation assumes a single query q repre- senting a single information need. The ﬁrst symbol is used to indicate that two functions are equivalent as ranking functions. rank equivalence: ∝ q e.g. g() ∝ q h() In developing the model, from the probability of relevance of a doc- ument to a term-weighting and document-scoring function, we make frequent use of transformations which thus preserve rank order. Such a transformation (in a document-scoring function, say) may be linear or non-linear, but must be strictly monotonic, so that if documents are ranked by the"
"bm25_prf_p08_c002","bm25_prf","bm25_prf.pdf","8","2","and document-scoring function, we make frequent use of transformations which thus preserve rank order. Such a transformation (in a document-scoring function, say) may be linear or non-linear, but must be strictly monotonic, so that if documents are ranked by the transformed function, they will be in the same rank order as if they had been ranked by the original function. The property of relevance is represented by a random variable Rel with two possible values: relevance Rel: rel , rel (relevant or not)"
"bm25_prf_p09_c001","bm25_prf","bm25_prf.pdf","9","1","2.4 Some Notation 339 As discussed above, we assume that relevance is a binary property of a document (given an information need). We will use the short-hand notation P(rel|d,q) to denote P(Rel = rel|d,q). For documents and queries, we generally assume a bag or set of words model. We have a vocabulary of terms indexed into the set V, each of which may be present or absent (in the set of words model) or may be present with some frequency (bag of words model). In either case the objects (documents or queries) may be represented as vectors over the space deﬁned by the vocabulary. Thus a document is: document: d := (tf 1,..., tf |V|), where tf i normally represents the frequency of termti in the document. We will also need to distinguish between the random variable TF i and its observed value in a document, tf i. The random variable will usually refer to the term frequencies of a given term in the vocabulary. However, the formulation of the basic model is somewhat more general than this, and can accommodate any discrete variable as a feature (e.g., any discrete property or attribute of the document). Thus we can re-interpret tf as simply representing presence or absence of a term; this is the basis of Section 3.1 below. Continuous variables can also be accommodated by replacing probability mass functionsTF i (of discrete variables) by probability density functions (of continuous variables); although we do not present a formal development of the"
"bm25_prf_p09_c002","bm25_prf","bm25_prf.pdf","9","2","this is the basis of Section 3.1 below. Continuous variables can also be accommodated by replacing probability mass functionsTF i (of discrete variables) by probability density functions (of continuous variables); although we do not present a formal development of the model with continuous variables, we will use this fact in Section 3.7 to introduce some non-textual continuous features into the model. A query is represented in two diﬀerent ways. In the ﬁrst, it is treated similarly as a vector: query: q := (qtf 1,..., qtf |V|) Here again the components qtf i may represent term frequencies in the query, or may represent a binary presence or absence feature. Throughout this survey we will need to sum or multiply variables of terms present in the query (i.e., with qtf i > 0). For this purpose we deﬁne the set of indices: query terms: q := {i|qtf i > 0} (indices of terms in the query)"
"bm25_prf_p10_c001","bm25_prf","bm25_prf.pdf","10","1","340 Development of the Basic Model 2.4.1 Preview of the Development The following provides an overview of the development of the basic model; the individual steps are discussed below. The main point to note is that we start with the very general PRP, and end up with an explicit document scoring function, composed of a simple sum of weights for the individual query terms present in the document. P(rel|d,q) ∝ q P(rel|d,q) P(rel|d,q) (2.1) = P(d|rel,q) P(d|rel,q) P(rel|q) P(rel|q) (2.2) ∝ q P(d|rel,q) P(d|rel,q) (2.3) ≈ ∏ i∈V P(TF i = tf i |rel,q) P(TF i = tf i |rel,q) (2.4) ≈ ∏ i∈q P(TF i = tf i |rel) P(TF i = tf i |rel) (2.5) ∝ q ∑ q log P(TF i = tf i |rel) P(TF i = tf i |rel) (2.6) = ∑ q Ui(tf i) (2.7) = ∑ q,tf i>0 Ui(tf i)+ ∑ q,tf i=0 Ui(0) − ∑ q,tf i>0 Ui(0) + ∑ q,tf i>0 Ui(0) (2.8) = ∑ q,tf i>0 (Ui(tf i) − Ui(0)) + ∑ q Ui(0) (2.9) ∝ q ∑ q,tf i>0 (Ui(tf i) − Ui(0)) (2.10) = ∑ q,tf i>0 wi (2.11)"
"bm25_prf_p11_c001","bm25_prf","bm25_prf.pdf","11","1","2.4 Some Notation 341 2.4.2 Details We start with the probability of relevance of a given document and query. The ﬁrst three steps are simple algebraic transformations. In Step (2.1), we simply replace the probability by an odds-ratio. 2 In Step (2.2), we perform Bayesian inversions on both numerator and denominator. In Step (2.3), we drop the second component which is independent of the document, and therefore does not aﬀect the rank- ing of the documents. In Step (2.4) (term independence assumption), we expand each probability as a product over the terms of the vocabulary. This step depends on an assumption of statistical independence between terms — actually a pair of such assumptions, for the relevant and non-relevant cases, respectively. Note that we are not assuming unconditional term independence, but a weaker form, namely conditional independence. 3 This is clearly a much more arguable step: in general terms will not be statistically independent in this fashion. The obvious reason for taking this step is to lead us to a simple and tractable (even if approximate) scoring function. However, we may make some further arguments to support this step: 1. Models of this type in other domains, known as Na¨ıve Bayes models, are well known to be remarkably good, simple and robust, despite signiﬁcant deviations from independence. Experimental evidence in IR provides some support for this general statement. 2. The pair of assumptions is not in general equivalent to a blanket assumption of independence between terms over the whole collection. On"
"bm25_prf_p11_c002","bm25_prf","bm25_prf.pdf","11","2","robust, despite signiﬁcant deviations from independence. Experimental evidence in IR provides some support for this general statement. 2. The pair of assumptions is not in general equivalent to a blanket assumption of independence between terms over the whole collection. On the contrary, for a pair of query terms, both statistically correlated with relevance, the pair of assumptions predict a positive association between the two terms over the whole collection. In fact we often observe such a positive association. In eﬀect the model says that this 2 This transformation is order preserving; the odds-ratio of p is p 1− p , and this function is a monotonous increasing function of p ∈ [0,1). 3 P(ab| c)= P(a| c)P(b| c)."
"bm25_prf_p12_c001","bm25_prf","bm25_prf.pdf","12","1","342 Development of the Basic Model positive association is induced by relevance to the query. 4 This is clearly an over-simpliﬁcation, but perhaps not such a bad one. 3. Cooper [11] has demonstrated that we can arrive at the same transformation on the basis of a weaker assumption, called linked dependence. 5 This is essentially that the degree of sta- tistical association between the terms is the same in the rel- evant as in the non-relevant subsets. Again, this theoretical result may help to explain the robustness of such a model. We may represent the independence assumptions by means of a graph- ical model, as in Figure 2.1. This diagram shows how the term frequen- cies (tf i)i∈V are assumed to be generated as stochastic observations dependant only on the state of the relevance variable Rel (a full expla- nation of graphical model diagrams is outside the scope of this paper, we refer the reader to [6]). In step (2.5) (query-terms assumption), we restrict ourselves to the query terms only: in eﬀect, we assume that for any non-query term, the ratio of conditional probabilities is constant and equal to one. 6 This might seem a drastic assumption (that no non-query terms have any association with relevance); however, this is not quite the explanation of the step. We have to consider the question of what information we Fig. 2.1 Graphical model indicating basic independence assumptions. 4 If P(a| c) >P (a| c) and similarly for b, then it follows that P(ab)"
"bm25_prf_p12_c002","bm25_prf","bm25_prf.pdf","12","2","quite the explanation of the step. We have to consider the question of what information we Fig. 2.1 Graphical model indicating basic independence assumptions. 4 If P(a| c) >P (a| c) and similarly for b, then it follows that P(ab) >P (a)P(b) even under the conditional independence assumptions made. 5 P (a,b| c) P (a,b| c) = P (a| c) P (a| c) P (b| c) P (b| c) . 6 Note that if the ratio is constant, then it must be equal to one; otherwise we would have one of the probability distribution with probabilities always higher than another one, which is impossible since they both need to sum to 1."
"bm25_prf_p13_c001","bm25_prf","bm25_prf.pdf","13","1","2.4 Some Notation 343 have on which to base an estimate of the probability of relevance. It is a reasonable prior assumption, and turns out to be a good one, that in general query terms are (positively) correlated with relevance. However, we can make no such assumption about non-query terms (a term relating to a completely diﬀerent topic could well be negatively correlated with relevance). In the absence of any link to the query, the obvious vague prior assumption about a random vocabulary term must be that it is not correlated with relevance to this query. Later we will consider the issue of query expansion, adding new terms to the query, when we have evidence to link a non-query term with relevance to the query. Again, we can illustrate the assumptions by means of a graphical model, as in Figure 2.2. This diagram shows that in this model the relevance variable only aﬀects terms in the query. Starting in Step (2.6) we use the following short-hand notation: under the summation operator we will writeq (the starting set of values for i) followed by conditions that i should satisfy. For example: ∑ q should be read as ∑ i∈q, and ∑ q,tf i>0 should be read as ∑ {i| i∈q,tf i>0}. In Step (2.6), we make a common, order-preserving transformation, namely we take a log. This allows us to express the product of proba- bilities as a sum of log probabilities — actually log-odds because of the ratio in the product."
"bm25_prf_p13_c002","bm25_prf","bm25_prf.pdf","13","2","In Step (2.6), we make a common, order-preserving transformation, namely we take a log. This allows us to express the product of proba- bilities as a sum of log probabilities — actually log-odds because of the ratio in the product. In Step (2.7), we rewrite the previous equation using a function U i(x): Ui(x): =l o gP(TF i = x|rel) P(TF i = x|rel) (2.12) Fig. 2.2 Graphical model for restriction to query terms."
"bm25_prf_p14_c001","bm25_prf","bm25_prf.pdf","14","1","344 Development of the Basic Model Note that this is not the log-odds function. Note also that in Step (2.7) each term frequencytf i will be applied to a diﬀerent function Ui(tf i). This is necessary since the weight of a term does not depend only on its frequency, but also in other factors such as the collection frequency, etc. The following two steps use an arithmetic trick (sometimes referred to as removing the zeros) which eliminates from the equation terms that are not present in the document. This is crucial for the eﬃcient implementation of PRF ranking functions using inverted indices. In Step (2.8), we do two things. In the ﬁrst line, the sum over query terms in Step (2.7) has been split into two groups: those terms that are present in the document (ﬁrst sum) and those that are absent (second sum). In the second line, we subtract and add the same quantity (the sum of zero frequency weights for terms in the document) leaving the result unchanged. The reason for doing this will become clear in the next step. In Step (2.9), we regroup the sums of Step (2.8). First we note that the ﬁrst and third sums in Step (2.8) are over the same terms, and can be grouped. This forms the ﬁrst sum in Step (2.9). Then we note that the second and fourth sums in Step (2.8) span all terms in the query. This forms the second sum in Step (2.9). In Step (2.10)"
"bm25_prf_p14_c002","bm25_prf","bm25_prf.pdf","14","2","can be grouped. This forms the ﬁrst sum in Step (2.9). Then we note that the second and fourth sums in Step (2.8) span all terms in the query. This forms the second sum in Step (2.9). In Step (2.10) we drop the last sum since its value is document- independent. We note that by doing so we are left with a single sum over terms present both in the document and in the query. We have removed terms in the query with zero frequency in the document. In Step (2.11), we again rewrite the equation using the short-hand notation: W i(x): = Ui(x) − Ui(0) (2.13) = log P(TF i = x|rel)P(TF i =0 |rel) P(TF i = x|rel)P(TF i =0 |rel) (2.14) wi := Wi(tf i) (2.15) Equation (2.14) is the formula for the basic weight of a query term in a document. BothUi and Wi are term-weighting functions which can be precomputed and stored at indexing time. The diﬀerence is that in"
"bm25_prf_p15_c001","bm25_prf","bm25_prf.pdf","15","1","2.5 A Note on Probabilities and Rank Equivalence 345 order to use theUi in a document, we would have to sum over all query terms, whether or not they are present in the document. With Wi,w e need only to consider the weights wi of terms present in the document (in eﬀect the rewriting has deﬁned the weight of absent terms as zero). This ﬁts very well with the sparseness of the document-term matrix — we have no need to calculate scores of any document that contains no query terms. Indeed, this is a highly desirable property for a scoring function to be used in an inverted-ﬁle-based document retrieval system, since it means that we can easily calculate the score of all documents with non-zero scores by merging the inverted lists of the query terms. As indicated above, the model is not restricted to terms and term frequencies — any property, attribute or feature of the document, or of the document–query pair, which we reasonably expect to provide some evidence as to relevance, may be included. Below we will consider static features of documents — properties that are not dependent on the query — for inclusion. Any discrete property with a natural zero can be dealt with using the W i form of the weight — if we want to include a property without such a natural zero, we need to revert to the U i form. We note also that both forms are simple linear models — the combi-"
