"evidence_id","doc_id","source_file","page","chunk_index","chunk_text"
"chain_of_retrieval_p08_c003","chain_of_retrieval","chain_of_retrieval.pdf","8","3","in Table 3 demonstrate that utilizing Llama-3B achieves very close performance compared to the 8B model, whereas Llama-1B exhibits a noticeable performance drop. Manual inspection re- veals that the 1B model frequently struggles to follow the given instructions, resulting in sub-optimal retrieval chains. Employing weaker LLMs also lowers the barrier to adopting more computationally expensive tree search strategies during data generation, which show great potential in mathematical reasoning tasks [7]. In contrast, distilling from a stronger model like GPT-4o yields a further perfor- mance boost, indicating that the quality of the retrieval chains is crucial for the ﬁnal performance. 8"
"chain_of_retrieval_p09_c001","chain_of_retrieval","chain_of_retrieval.pdf","9","1","5.3 Does Chain-of-Retrieval Always Help? 2 4 6 8 10 Chain Length 90 91 92 93 94 95EM FEVER greedy best-of-4 best-of-8 2 4 6 8 10 Chain Length 87 88 89 90 91EM TQA greedy best-of-4 best-of-8 2 4 6 8 10 Chain Length 59 60 61 62 63 64 65 66Accuracy NQ greedy best-of-4 best-of-8 Figure 4: Scaling test-time compute across three datasets from the KILT benchmark. We report scores on the public validation set. Multi-hop QA datasets are speciﬁcally designed to evaluate complex reasoning capabilities and are expected to beneﬁt from the chain-of-retrieval mechanism. Table 1 presents empirical evidence supporting this assertion. In contrast, for tasks that a single retrieval step is typically sufﬁcient, the advantage tends to be marginal, as demonstrated in Figure 4. Datasets such as NQ [ 19] and TriviaQA [17] are known for their (mostly) single-hop nature. This phenomenon implies that decoding strategies should be adaptive based on the complexity of the query. Additional results on the full KILT benchmark are listed in Appendix Table 7, where similar observations for other task types also hold. 5.4 Learning to Stop at Test Time 2.0 1.5 1.0 0.5 0.0 0.5 1.0 1.5 2.0 Early Stop Logit Bias 18 20 22 24 26 28EM EM Score L=6 L=0 3.9k 4.9k 5.9k 6.8k 7.8k T oken Consumption # T okens MuSiQue (Greedy Decoding) Figure 5: Learning to stop at test time. Larger logit bias values result in earlier stopping. L = 6 correspond to always performing 6"
"chain_of_retrieval_p09_c002","chain_of_retrieval","chain_of_retrieval.pdf","9","2","L=6 L=0 3.9k 4.9k 5.9k 6.8k 7.8k T oken Consumption # T okens MuSiQue (Greedy Decoding) Figure 5: Learning to stop at test time. Larger logit bias values result in earlier stopping. L = 6 correspond to always performing 6 retrieval steps, while L = 0 indicate no intermediate retrieval steps. Instead of always performing L retrieval steps, we explore a model variant that learns to stop at test time. After each retrieval step, the model is prompted to predict whether the information gathered thus far sufﬁces to answer the query. Note that this prompt itself also incurs token consumption and additional cost. The decoding space is constrained to two tokens: “Yes” and “No”. If the decoded output is “ Yes”, no further sub-queries are generated. By adjusting the logit bias of the “ Yes” token, we can control the early stopping behavior. During the training phase, an additional loss term is added for the stop prediction task. The target output is “ Yes” if the current retrieval chain encompasses the preﬁx that maximizes the likelihood of the ﬁnal answer, and “No” oth- erwise. The associated prompt template is in Appendix Section D. In Figure 5, we illustrate how the performance varies along with the token consumption on the MuSiQue dataset. While early stopping can save some amount of token quota, it comes at the cost of performance degradation. The optimal conﬁguration depends on the dataset characteristics and the quality expectations. 9"
"chain_of_retrieval_p10_c001","chain_of_retrieval","chain_of_retrieval.pdf","10","1","5.5 Does CoRAG Learn to Retrieve Better? To evaluate whether CoRAG improves retrieval quality beyond just answer accuracy, we measure retrieval recall across multiple datasets. We report Recall@k metrics for k∈{ 10, 20, 100}, compar- ing standard retrieval using E5large against our approach. We follow the evaluation protocol from DPR [18] for calculating recall based on answer matches, as not all datasets provide gold supporting paragraphs. For CoRAG, we utilize reciprocal rank fusion to merge multiple retrieval results from the chain into a single ranked list, from which recall is calculated. Table 4: Retrieval recall comparison between standard retrieval and CoRAG across multi-hop QA datasets. R@10 R@20 R@100 HotpotQA w/ E5large 59.1 65.2 76.8 w/ CoRAG 72.1 76.7 84.3 2WikiMultiHopQA w/ E5large 54.9 62.1 74.6 w/ CoRAG 81.4 84.8 88.8 Bamboogle w/ E5large 31.2 40.0 57.6 w/ CoRAG 59.2 68.0 75.2 MuSiQue w/ E5large 29.0 36.5 52.7 w/ CoRAG 47.1 54.6 68.4 The results in Table 4 demonstrate that CoRAG consistently improves recall across all datasets and recall thresholds. The improvements are particularly pronounced on more challenging datasets like MuSiQue and Bamboogle, where single-step retrieval struggles most. This indicates that CoRAG’s iterative query reformulation and decomposition strategy effectively addresses the limitations of traditional dense retrieval, enabling the model to gather more relevant information through multiple retrieval steps. 6 Conclusion In this work, we introduce CoRAG, a framework that teaches LLMs to conduct iterative retrieval and reasoning to answer complex queries. The intermediate retrieval chains are automatically generated via rejection sampling,"
"chain_of_retrieval_p10_c002","chain_of_retrieval","chain_of_retrieval.pdf","10","2","more relevant information through multiple retrieval steps. 6 Conclusion In this work, we introduce CoRAG, a framework that teaches LLMs to conduct iterative retrieval and reasoning to answer complex queries. The intermediate retrieval chains are automatically generated via rejection sampling, thereby alleviating the need for manual annotation. At test time, we offer multiple decoding strategies to manage the trade-off between performance and compute. Our experiments demonstrate that CoRAG-8B achieves state-of-the-art performance on both multi- hop QA datasets and the KILT benchmark, surpassing many baselines built with larger LLMs. A comprehensive analysis is conducted to understand its scaling behavior and generalization capability. In the future, we intend to extend CoRAG to more challenging and economically valuable RAG tasks, advancing towards building factual and trustworthy AI systems. 7 Limitations and Broader Impacts This study primarily investigates RAG tasks characterized by short and easy-to-verify answers, such as multi-hop QA and entity linking. However, real-world applications often necessitate addressing more complex tasks that demand generating long-form outputs. A signiﬁcant challenge in long-form generation lies in the absence of robust evaluation metrics within the current research landscape. Regarding broader impacts, the proposed framework aims to improve the factuality and groundedness of language model outputs. It is anticipated that this work can facilitate more efﬁcient and effective information retrieval for users. Nevertheless, the inherent risk of hallucination persists and warrants careful monitoring in practical deployments. References [1] Akari Asai, Zeqiu Wu, Yizhong Wang, Avirup Sil, and Hannaneh Hajishirzi. Self-rag: Learn- ing to retrieve, generate, and critique"
"chain_of_retrieval_p10_c003","chain_of_retrieval","chain_of_retrieval.pdf","10","3","effective information retrieval for users. Nevertheless, the inherent risk of hallucination persists and warrants careful monitoring in practical deployments. References [1] Akari Asai, Zeqiu Wu, Yizhong Wang, Avirup Sil, and Hannaneh Hajishirzi. Self-rag: Learn- ing to retrieve, generate, and critique through self-reﬂection. In The Twelfth International 10"
"chain_of_retrieval_p11_c001","chain_of_retrieval","chain_of_retrieval.pdf","11","1","Conference on Learning Representations, ICLR 2024, Vienna, Austria, May 7-11, 2024. Open- Review.net, 2024. URL https://openreview.net/forum?id=hSyW5go0v8. [2] Michele Bevilacqua, Giuseppe Ottaviano, Patrick S. H. Lewis, Scott Yih, Sebastian Riedel, and Fabio Petroni. Autoregressive search engines: Generating substrings as document iden- tiﬁers. In Sanmi Koyejo, S. Mohamed, A. Agarwal, Danielle Belgrave, K. Cho, and A. Oh, editors, Advances in Neural Information Processing Systems 35: Annual Conference on Neural Information Processing Systems 2022, NeurIPS 2022, New Orleans, LA, USA, November 28 - December 9, 2022 , 2022. URL http://papers.nips.cc/paper_files/paper/2022/ hash/cd88d62a2063fdaf7ce6f9068fb15dcd-Abstract-Conference.html. [3] Christian Buck, Jannis Bulian, Massimiliano Ciaramita, Wojciech Gajewski, Andrea Gesmundo, Neil Houlsby, and Wei Wang. Ask the right questions: Active question reformulation with reinforcement learning. arXiv preprint arXiv:1705.07830, 2017. [4] Collin Burns, Pavel Izmailov, Jan Hendrik Kirchner, Bowen Baker, Leo Gao, Leopold Aschen- brenner, Yining Chen, Adrien Ecoffet, Manas Joglekar, Jan Leike, Ilya Sutskever, and Jeffrey Wu. Weak-to-strong generalization: Eliciting strong capabilities with weak supervision. InForty- ﬁrst International Conference on Machine Learning, ICML 2024, Vienna, Austria, July 21-27, 2024. OpenReview.net, 2024. URL https://openreview.net/forum?id=ghNRg2mEgN. [5] Abhimanyu Dubey, Abhinav Jauhri, Abhinav Pandey, Abhishek Kadian, Ahmad Al-Dahle, Aiesha Letman, Akhil Mathur, Alan Schelten, Amy Yang, Angela Fan, et al. The llama 3 herd of models. ArXiv preprint, abs/2407.21783, 2024. URL https://arxiv.org/abs/2407. 21783. [6] Yunfan Gao, Yun Xiong, Xinyu Gao, Kangxiang Jia, Jinliu Pan, Yuxi Bi, Yi Dai, Jiawei Sun, Qianyu Guo, Meng Wang, and Haofen Wang. Retrieval-augmented generation for large language models: A survey. ArXiv preprint, abs/2312.10997, 2023. URL https://arxiv. org/abs/2312.10997. [7] Xinyu Guan,"
"chain_of_retrieval_p11_c002","chain_of_retrieval","chain_of_retrieval.pdf","11","2","Gao, Yun Xiong, Xinyu Gao, Kangxiang Jia, Jinliu Pan, Yuxi Bi, Yi Dai, Jiawei Sun, Qianyu Guo, Meng Wang, and Haofen Wang. Retrieval-augmented generation for large language models: A survey. ArXiv preprint, abs/2312.10997, 2023. URL https://arxiv. org/abs/2312.10997. [7] Xinyu Guan, Li Lyna Zhang, Yifei Liu, Ning Shang, Youran Sun, Yi Zhu, Fan Yang, and Mao Yang. rstar-math: Small llms can master math reasoning with self-evolved deep thinking. ArXiv preprint, abs/2501.04519, 2025. URL https://arxiv.org/abs/2501.04519. [8] Xanh Ho, Anh-Khoa Duong Nguyen, Saku Sugawara, and Akiko Aizawa. Constructing a multi-hop QA dataset for comprehensive evaluation of reasoning steps. In Donia Scott, Nuria Bel, and Chengqing Zong, editors, Proceedings of the 28th International Conference on Computational Linguistics, pages 6609–6625, Barcelona, Spain (Online), 2020. International Committee on Computational Linguistics. doi: 10.18653/v1/2020.coling-main.580. URL https://aclanthology.org/2020.coling-main.580. [9] Sebastian Hofstätter, Jiecao Chen, Karthik Raman, and Hamed Zamani. Multi-task retrieval- augmented text generation with relevance sampling. ArXiv preprint, abs/2207.03030, 2022. URL https://arxiv.org/abs/2207.03030. [10] Aaron Hurst, Adam Lerer, Adam P Goucher, Adam Perelman, Aditya Ramesh, Aidan Clark, AJ Ostrow, Akila Welihinda, Alan Hayes, Alec Radford, et al. Gpt-4o system card. ArXiv preprint, abs/2410.21276, 2024. URL https://arxiv.org/abs/2410.21276. [11] Gautier Izacard, Patrick Lewis, Maria Lomeli, Lucas Hosseini, Fabio Petroni, Timo Schick, Jane Dwivedi-Yu, Armand Joulin, Sebastian Riedel, and Edouard Grave. Atlas: Few-shot learning with retrieval augmented language models. Journal of Machine Learning Research, 24(251): 1–43, 2023. [12] Aaron Jaech, Adam Kalai, Adam Lerer, Adam Richardson, Ahmed El-Kishky, Aiden Low, Alec Helyar, Aleksander Madry, Alex Beutel, Alex Carney, et al. Openai o1 system card."
"chain_of_retrieval_p11_c003","chain_of_retrieval","chain_of_retrieval.pdf","11","3","with retrieval augmented language models. Journal of Machine Learning Research, 24(251): 1–43, 2023. [12] Aaron Jaech, Adam Kalai, Adam Lerer, Adam Richardson, Ahmed El-Kishky, Aiden Low, Alec Helyar, Aleksander Madry, Alex Beutel, Alex Carney, et al. Openai o1 system card. ArXiv preprint, abs/2412.16720, 2024. URL https://arxiv.org/abs/2412.16720. [13] Zhengbao Jiang, Frank Xu, Luyu Gao, Zhiqing Sun, Qian Liu, Jane Dwivedi-Yu, Yiming Yang, Jamie Callan, and Graham Neubig. Active retrieval augmented generation. In Houda Bouamor, Juan Pino, and Kalika Bali, editors,Proceedings of the 2023 Conference on Empirical Methods in Natural Language Processing, pages 7969–7992, Singapore, 2023. Association 11"
"chain_of_retrieval_p12_c001","chain_of_retrieval","chain_of_retrieval.pdf","12","1","for Computational Linguistics. doi: 10.18653/v1/2023.emnlp-main.495. URL https:// aclanthology.org/2023.emnlp-main.495. [14] Ziyan Jiang, Xueguang Ma, and Wenhu Chen. Longrag: Enhancing retrieval-augmented generation with long-context llms. ArXiv preprint, abs/2406.15319, 2024. URL https: //arxiv.org/abs/2406.15319. [15] Bowen Jin, Hansi Zeng, Zhenrui Yue, Jinsung Yoon, Sercan Arik, Dong Wang, Hamed Za- mani, and Jiawei Han. Search-r1: Training llms to reason and leverage search engines with reinforcement learning. arXiv preprint arXiv:2503.09516, 2025. [16] Jiajie Jin, Yutao Zhu, Xinyu Yang, Chenghao Zhang, and Zhicheng Dou. Flashrag: A modular toolkit for efﬁcient retrieval-augmented generation research.ArXiv preprint, abs/2405.13576, 2024. URL https://arxiv.org/abs/2405.13576. [17] Mandar Joshi, Eunsol Choi, Daniel Weld, and Luke Zettlemoyer. TriviaQA: A large scale distantly supervised challenge dataset for reading comprehension. In Regina Barzilay and Min- Yen Kan, editors, Proceedings of the 55th Annual Meeting of the Association for Computational Linguistics (Volume 1: Long Papers), pages 1601–1611, Vancouver, Canada, 2017. Association for Computational Linguistics. doi: 10.18653/v1/P17-1147. URL https://aclanthology. org/P17-1147. [18] Vladimir Karpukhin, Barlas Oguz, Sewon Min, Patrick Lewis, Ledell Wu, Sergey Edunov, Danqi Chen, and Wen-tau Yih. Dense passage retrieval for open-domain question answering. In Bonnie Webber, Trevor Cohn, Yulan He, and Yang Liu, editors,Proceedings of the 2020 Conference on Empirical Methods in Natural Language Processing (EMNLP), pages 6769–6781, Online, 2020. Association for Computational Linguistics. doi: 10.18653/v1/2020.emnlp-main.550. URL https://aclanthology.org/2020.emnlp-main.550. [19] Tom Kwiatkowski, Jennimaria Palomaki, Olivia Redﬁeld, Michael Collins, Ankur Parikh, Chris Alberti, Danielle Epstein, Illia Polosukhin, Jacob Devlin, Kenton Lee, Kristina Toutanova, Llion Jones, Matthew Kelcey, Ming-Wei Chang, Andrew M. Dai, Jakob Uszkoreit, Quoc Le, and Slav Petrov. Natural"
"chain_of_retrieval_p12_c002","chain_of_retrieval","chain_of_retrieval.pdf","12","2","[19] Tom Kwiatkowski, Jennimaria Palomaki, Olivia Redﬁeld, Michael Collins, Ankur Parikh, Chris Alberti, Danielle Epstein, Illia Polosukhin, Jacob Devlin, Kenton Lee, Kristina Toutanova, Llion Jones, Matthew Kelcey, Ming-Wei Chang, Andrew M. Dai, Jakob Uszkoreit, Quoc Le, and Slav Petrov. Natural questions: A benchmark for question answering research. Transactions of the Association for Computational Linguistics, 7:452–466, 2019. doi: 10.1162/tacl_a_00276. URL https://aclanthology.org/Q19-1026. [20] Patrick S. H. Lewis, Ethan Perez, Aleksandra Piktus, Fabio Petroni, Vladimir Karpukhin, Naman Goyal, Heinrich Küttler, Mike Lewis, Wen-tau Yih, Tim Rocktäschel, Sebastian Riedel, and Douwe Kiela. Retrieval-augmented generation for knowledge-intensive NLP tasks. In Hugo Larochelle, Marc’Aurelio Ranzato, Raia Hadsell, Maria-Florina Balcan, and Hsuan-Tien Lin, editors, Advances in Neural Information Processing Systems 33: Annual Conference on Neural Information Processing Systems 2020, NeurIPS 2020, December 6- 12, 2020, virtual , 2020. URL https://proceedings.neurips.cc/paper/2020/hash/ 6b493230205f780e1bc26945df7481e5-Abstract.html. [21] Xiaoxi Li, Jiajie Jin, Yujia Zhou, Yuyao Zhang, Peitian Zhang, Yutao Zhu, and Zhicheng Dou. From matching to generation: A survey on generative information retrieval. ArXiv preprint, abs/2404.14851, 2024. URL https://arxiv.org/abs/2404.14851. [22] Xiaoxi Li, Guanting Dong, Jiajie Jin, Yuyao Zhang, Yujia Zhou, Yutao Zhu, Peitian Zhang, and Zhicheng Dou. Search-o1: Agentic search-enhanced large reasoning models. ArXiv preprint, abs/2501.05366, 2025. URL https://arxiv.org/abs/2501.05366. [23] Xi Victoria Lin, Xilun Chen, Mingda Chen, Weijia Shi, Maria Lomeli, Richard James, Pedro Rodriguez, Jacob Kahn, Gergely Szilvasy, Mike Lewis, Luke Zettlemoyer, and Wen-tau Yih. RA-DIT: retrieval-augmented dual instruction tuning. In The Twelfth International Conference on Learning Representations, ICLR 2024, Vienna, Austria, May 7-11, 2024. OpenReview.net, 2024. URL https://openreview.net/forum?id=22OTbutug9. [24] Xueguang Ma,"
"chain_of_retrieval_p12_c003","chain_of_retrieval","chain_of_retrieval.pdf","12","3","Pedro Rodriguez, Jacob Kahn, Gergely Szilvasy, Mike Lewis, Luke Zettlemoyer, and Wen-tau Yih. RA-DIT: retrieval-augmented dual instruction tuning. In The Twelfth International Conference on Learning Representations, ICLR 2024, Vienna, Austria, May 7-11, 2024. OpenReview.net, 2024. URL https://openreview.net/forum?id=22OTbutug9. [24] Xueguang Ma, Liang Wang, Nan Yang, Furu Wei, and Jimmy Lin. Fine-tuning llama for multi-stage text retrieval. In Grace Hui Yang, Hongning Wang, Sam Han, Claudia Hauff, Guido Zuccon, and Yi Zhang, editors, Proceedings of the 47th International ACM SIGIR Conference 12"
"chain_of_retrieval_p13_c001","chain_of_retrieval","chain_of_retrieval.pdf","13","1","on Research and Development in Information Retrieval, SIGIR 2024, Washington DC, USA, July 14-18, 2024 , pages 2421–2425. ACM, 2024. doi: 10.1145/3626772.3657951. URL https://doi.org/10.1145/3626772.3657951. [25] Jean Maillard, Vladimir Karpukhin, Fabio Petroni, Wen-tau Yih, Barlas Oguz, Veselin Stoyanov, and Gargi Ghosh. Multi-task retrieval for knowledge-intensive tasks. In Chengqing Zong, Fei Xia, Wenjie Li, and Roberto Navigli, editors,Proceedings of the 59th Annual Meeting of the Association for Computational Linguistics and the 11th International Joint Conference on Natural Language Processing (Volume 1: Long Papers), pages 1098–1111, Online, 2021. Association for Computational Linguistics. doi: 10.18653/v1/2021.acl-long.89. URL https: //aclanthology.org/2021.acl-long.89. [26] Reiichiro Nakano, Jacob Hilton, Suchir Balaji, Jeff Wu, Long Ouyang, Christina Kim, Christo- pher Hesse, Shantanu Jain, Vineet Kosaraju, William Saunders, et al. Webgpt: Browser-assisted question-answering with human feedback. ArXiv preprint, abs/2112.09332, 2021. URL https://arxiv.org/abs/2112.09332. [27] Fabio Petroni, Aleksandra Piktus, Angela Fan, Patrick Lewis, Majid Yazdani, Nicola De Cao, James Thorne, Yacine Jernite, Vladimir Karpukhin, Jean Maillard, Vassilis Plachouras, Tim Rocktäschel, and Sebastian Riedel. KILT: a benchmark for knowledge intensive language tasks. In Kristina Toutanova, Anna Rumshisky, Luke Zettlemoyer, Dilek Hakkani-Tur, Iz Beltagy, Steven Bethard, Ryan Cotterell, Tanmoy Chakraborty, and Yichao Zhou, editors,Proceedings of the 2021 Conference of the North American Chapter of the Association for Computational Linguistics: Human Language Technologies , pages 2523–2544, Online, 2021. Association for Computational Linguistics. doi: 10.18653/v1/2021.naacl-main.200. URL https:// aclanthology.org/2021.naacl-main.200. [28] Oﬁr Press, Muru Zhang, Sewon Min, Ludwig Schmidt, Noah Smith, and Mike Lewis. Measuring and narrowing the compositionality gap in language models. In Houda Bouamor, Juan Pino, and Kalika"
"chain_of_retrieval_p13_c002","chain_of_retrieval","chain_of_retrieval.pdf","13","2","2021. Association for Computational Linguistics. doi: 10.18653/v1/2021.naacl-main.200. URL https:// aclanthology.org/2021.naacl-main.200. [28] Oﬁr Press, Muru Zhang, Sewon Min, Ludwig Schmidt, Noah Smith, and Mike Lewis. Measuring and narrowing the compositionality gap in language models. In Houda Bouamor, Juan Pino, and Kalika Bali, editors, Findings of the Association for Computational Linguistics: EMNLP 2023, pages 5687–5711, Singapore, 2023. Association for Computational Linguistics. doi: 10.18653/ v1/2023.ﬁndings-emnlp.378. URL https://aclanthology.org/2023.findings-emnlp. 378. [29] Pranav Rajpurkar, Jian Zhang, Konstantin Lopyrev, and Percy Liang. SQuAD: 100,000+ questions for machine comprehension of text. In Jian Su, Kevin Duh, and Xavier Carreras, editors, Proceedings of the 2016 Conference on Empirical Methods in Natural Language Processing, pages 2383–2392, Austin, Texas, 2016. Association for Computational Linguistics. doi: 10.18653/v1/D16-1264. URL https://aclanthology.org/D16-1264. [30] Zhihong Shao, Yeyun Gong, Yelong Shen, Minlie Huang, Nan Duan, and Weizhu Chen. Enhancing retrieval-augmented large language models with iterative retrieval-generation synergy. In Houda Bouamor, Juan Pino, and Kalika Bali, editors, Findings of the Association for Computational Linguistics: EMNLP 2023 , pages 9248–9274, Singapore, 2023. Association for Computational Linguistics. doi: 10.18653/v1/2023.ﬁndings-emnlp.620. URL https: //aclanthology.org/2023.findings-emnlp.620. [31] Gemini Team, Petko Georgiev, Ving Ian Lei, Ryan Burnell, Libin Bai, Anmol Gulati, Garrett Tanzer, Damien Vincent, Zhufeng Pan, Shibo Wang, et al. Gemini 1.5: Unlocking multimodal understanding across millions of tokens of context. ArXiv preprint, abs/2403.05530, 2024. URL https://arxiv.org/abs/2403.05530. [32] Harsh Trivedi, Niranjan Balasubramanian, Tushar Khot, and Ashish Sabharwal. MuSiQue: Multihop questions via single-hop question composition. Transactions of the Association for Computational Linguistics, 10:539–554, 2022. doi: 10.1162/tacl_a_00475. URL https: //aclanthology.org/2022.tacl-1.31. [33] Harsh Trivedi, Niranjan Balasubramanian, Tushar"
"chain_of_retrieval_p13_c003","chain_of_retrieval","chain_of_retrieval.pdf","13","3","2024. URL https://arxiv.org/abs/2403.05530. [32] Harsh Trivedi, Niranjan Balasubramanian, Tushar Khot, and Ashish Sabharwal. MuSiQue: Multihop questions via single-hop question composition. Transactions of the Association for Computational Linguistics, 10:539–554, 2022. doi: 10.1162/tacl_a_00475. URL https: //aclanthology.org/2022.tacl-1.31. [33] Harsh Trivedi, Niranjan Balasubramanian, Tushar Khot, and Ashish Sabharwal. Interleaving retrieval with chain-of-thought reasoning for knowledge-intensive multi-step questions. In Anna Rogers, Jordan Boyd-Graber, and Naoaki Okazaki, editors, Proceedings of the 61st Annual Meeting of the Association for Computational Linguistics (Volume 1: Long Papers) , pages 10014–10037, Toronto, Canada, 2023. Association for Computational Linguistics. doi: 10.18653/v1/2023.acl-long.557. URL https://aclanthology.org/2023.acl-long.557. 13"
"chain_of_retrieval_p14_c001","chain_of_retrieval","chain_of_retrieval.pdf","14","1","[34] Liang Wang, Nan Yang, Xiaolong Huang, Binxing Jiao, Linjun Yang, Daxin Jiang, Rangan Majumder, and Furu Wei. Text embeddings by weakly-supervised contrastive pre-training. ArXiv preprint, abs/2212.03533, 2022. URL https://arxiv.org/abs/2212.03533. [35] Liang Wang, Nan Yang, Xiaolong Huang, Linjun Yang, Rangan Majumder, and Furu Wei. Improving text embeddings with large language models. ArXiv preprint, abs/2401.00368, 2024. URL https://arxiv.org/abs/2401.00368. [36] Jason Wei, Xuezhi Wang, Dale Schuurmans, Maarten Bosma, Brian Ichter, Fei Xia, Ed H. Chi, Quoc V . Le, and Denny Zhou. Chain-of-thought prompting elicits reasoning in large language models. In Sanmi Koyejo, S. Mohamed, A. Agarwal, Danielle Belgrave, K. Cho, and A. Oh, editors, Advances in Neural Information Processing Systems 35: Annual Conference on Neural Information Processing Systems 2022, NeurIPS 2022, New Orleans, LA, USA, November 28 - December 9, 2022 , 2022. URL http://papers.nips.cc/paper_files/paper/2022/ hash/9d5609613524ecf4f15af0f7b31abca4-Abstract-Conference.html. [37] An Yang, Baosong Yang, Beichen Zhang, Binyuan Hui, Bo Zheng, Bowen Yu, Chengyuan Li, Dayiheng Liu, Fei Huang, Haoran Wei, et al. Qwen2. 5 technical report. ArXiv preprint, abs/2412.15115, 2024. URL https://arxiv.org/abs/2412.15115. [38] An Yang, Anfeng Li, Baosong Yang, Beichen Zhang, Binyuan Hui, Bo Zheng, Bowen Yu, Chang Gao, Chengen Huang, Chenxu Lv, et al. Qwen3 technical report. arXiv preprint arXiv:2505.09388, 2025. [39] Zhilin Yang, Peng Qi, Saizheng Zhang, Yoshua Bengio, William Cohen, Ruslan Salakhutdinov, and Christopher D. Manning. HotpotQA: A dataset for diverse, explainable multi-hop question answering. In Ellen Riloff, David Chiang, Julia Hockenmaier, and Jun’ichi Tsujii, editors, Proceedings of the 2018 Conference on Empirical Methods in Natural Language Processing, pages 2369–2380, Brussels,"
